5109,"Enclave Cir",,"Franklin Twp.",08873-7469,,,,,,274267,,,,,,,3789,,2024-03-04,499000,,,,,Active,,,Somerset,"Schoolhouse Rd to Canal Walk to R on Massachusetts to Enclave Circle","2024-03-04 17:18:59.0",3888885,,,,,,,,,,,,,,,,,,,,,,,FRANKLIN,FRANKLIN,2708-00513-0044-00005-0109-,,392000,2,2.00,2,0,"CANAL WALK",560,"COMMON ELEMENTS",2,2,2012,"1 Unit, Forced Hot Air","1 Unit, Ceiling Fan, Central Air",Yes,"Blinds,CODetect,Drapes,AlrmFire,CeilHigh,SecurSys,SmokeDet,SoakTub,StallTub,WlkInCls,WndwTret","Curbs, Deck, Tennis Courts, Thermal Windows/Doors","First Floor Unit, Multi Floor Unit",,,,,,,,No,,6,0,"Asphalt Shingle","Stone, Vinyl Siding",,0.00,*,,,"Carbon Monoxide Detector, Dishwasher, Dryer, Microwave Oven, Range/Oven-Gas, Refrigerator, Self Cleaning Oven, Washer",192000,*,200000,*,,*,Monthly,,"Soaking Tub, Stall Shower, Stall Shower And Tub",First,First,,,513.44,*,,,,,No,,,,"Club House, Elevator, Exercise Room, Pool-Outdoor, Storage, Tennis Courts",,27,*,*,,,Yes,Assigned,,No,,,"Maintenance-Common Area, Maintenance-Exterior, Sewer Fees, Snow Removal, Trash Collection",,,,"Carpeting, Tile","GarUnder,InEntrnc,SeeRem",No,Gas-Natural,24,"2024-03-04 17:18:59.0",5273094,40.52662,,,,"KELLER WILLIAMS TOWNE SQUARE REAL",908-766-0085,,-74.57007,,5.109,*,*,,,,,,,,,"Fee Simple","Cats OK, Dogs OK",,"Association Pool","At Closing",Tan,"Discover luxury living at its finest in this one-level end unit nestled within an Active Adult Community. Step inside this Andover Model to find a seamless blend of sophistication and comfort which includes over $30K n upgrades .Beautiful open floor plan features Porcelain Tile Floors, custom wains coating, Crown Molding throughout main living space. Entertain effortlessly in the grand kitchen featuring 42"" Maple Cabinetry, Magnificent Granite Countertops and Breakfast Bar complete with custom tiled backsplash which over looks Dining Rm/Living Rm combo and Sliders to Double Patio. Retreat to the luxurious comfort in the Master Bedroom sanctuary featuring Custom Window Seat, Double Bookcase and His/Hers walk in Closet,  En-suite with dual sinks, walk in shower and Soaking Tub. 2nd Bedroom is perfect for guest with an adjacent full bath, tub and shower. Can also be used as home office. Laundry room incudes abundant storage and utility room. All blinds  and window coverings included. Convenience meets Security with an elevator to Underground Parking Garage. Unit includes 2 spaces. Resort Style Amenities include Pool, Tennis and Bocce Court. Clubhouse for year round activities. Conveniently Located near major highways, Shopping and NJ Transit. Don't Miss out on this opportunity to call this your New Home!",08873,,,,,,"Living/Dining Combo",First,,,"Breakfast Bar, Pantry, See Remarks",First,First,"2Bedroom,BathMain,DiningRm,InsdEntr,Kitchen,Laundry,LivingRm,Pantry,Storage,Utility",,,,"1st Floor, Full Bath, Walk-In Closet","Laundry Room",First,"Utility Room",First,,,,,,"Garbage Included","Public Sewer",,,1605,*,5109,*,"First Floor Unit",,,7569,*,*,1.931,*,2023,2023,*,2708,*,*,"All Underground, Electric",No,"Public Water",Electric,,Approximate,*,,Condo/Coop/Townhouse,Y,,"See Remarks",,,,Yes,,"2024-03-04 09:47:16.596",Active,"2024-03-04 09:47:17.0",Y,A,,N,N,908-766-0085
106,"Kenneth Ln",,"Hackettstown Town",07840-1016,,,,,,238576,,,,,,404157,002463,,2024-03-04,395000,,,,,"Coming Soon",,,Warren,"From Rt 80 W, Exit 19, Left off Exit to 517. At 2nd light, cross over Main (Rt 46) on Grand Ave. Left onto College View Dr, First Left to Kenneth Ln.","2024-03-05 10:00:06.0",3888886,,,,,,,,,,,,,,,,,,,,,,,,,3008-00107-0000-00152-0000-,,245600,3,1.00,1,0,,,75X143,0,,1965,"1 Unit, Forced Hot Air","1 Unit, Attic Fan, Ceiling Fan, Central Air",No,"Blinds,CODetect,Drapes,FireExtg,SmokeDet,TubShowr,WndwTret","Curbs, Enclosed Porch(es), Patio, Sidewalk, Storage Shed, Thermal Windows/Doors, Wood Fence",Ranch,15x10,15x10,11x9,,16x10,19x14,,No,15x14,7,1,"Asphalt Shingle","Composition Shingle",,0.25,*,,,"Carbon Monoxide Detector, Dishwasher, Kitchen Exhaust Fan, Microwave Oven, Range/Oven-Gas, Refrigerator, Satellite Dish/Antenna, Self Cleaning Oven",125400,*,120200,*,,*,,,,First,First,First,,107,*,,,,,No,,,,,,30,*,*,,,Yes,"2 Car Width, Concrete",,Unknown,"BD Chandelier & Pergola Excluded. Washer/Dryer & Swing Set Negotiable",,,,,"Gas Fireplace, Living Room, Wood Stove-Freestanding","Laminate, Wood",,,Gas-Natural,28,"2024-03-05 10:02:45.0",5273093,40.83994174564018,,,,"COLDWELL BANKER REALTY",908-735-8080,,-74.8378988262266,"Cul-De-Sac, Level Lot, Open Lot",152,*,*,7x7,14x12,,,,,,,"Fee Simple",,,,POT,Green,"One Floor Living! Discover the Charm of this inviting three bedroom ranch on a cul-de-sac lot in a desirable neighborhood! Custom woodwork adds character to the living room with hardwood floors, gas free-standing stove, mounted tv and triple french doors leading to the patio for outdoor entertaining. The updated kitchen is complete with recessed lighting, center island, granite counters and stainless appliances. Large formal dining room with hardwood floors and a beautiful chandelier. Laundry/Utility Room conveniently located off kitchen with exterior door. Primary Bedroom w Ceiling Fan & Triple Closet. Two Additional Bedrooms. Two Linen Closets in Hallway. The garage has been transformed into the Formal Dining Room and extra storage space. Enjoy the views of all seasons in the spacious sunroom overlooking the fenced backyard and storage shed boarding state land!",07840,,2003,,,,"Formal Dining Room",First,,,"Center Island, Eat-In Kitchen, Pantry",First,First,"3 Bedrooms, Bath Main, Dining Room, Foyer, Kitchen, Laundry Room, Living Room, Sunroom",,,,"1st Floor","Laundry Room",First,Sunroom,First,,,,,,"Cable TV Available, Garbage Extra Charge","Public Sewer",,,,*,106,*,Ranch,,,8286,*,*,3.374,*,2023,2023,*,3008,*,*,"All Underground, Gas-Natural",No,"Public Water","From Furnace",,"Approximate, Renovated",*,,"Single Family",Y,,"See Remarks",,,,No,,"2024-03-04 09:51:14.804","Coming Soon","2024-03-04 09:51:15.0",Y,A,2024-03-09,Y,Y,908-500-1939
509,"Boulevard-Unit A",A,"Westfield Town",07090-3207,,,,,,235425,,,,,,254232,000345,,2024-03-04,999900,,,,,Active,,,Union,"South Avenue to Boulevard. #509.","2024-03-06 14:26:19.0",3888887,residential,,,,,,,,,,,,,,,,,,,,,,Edison,Westfield,2920-03007-0000-00021-0000-C0001,,889200,4,4.10,4,1,,,.155,1,2,2016,"2 Units, Forced Hot Air, Multi-Zone","2 Units, Central Air, Multi-Zone Cooling",No,"Blinds,CODetect,FireExtg,CeilHigh,Shades,Skylight,SmokeDet,StallShw,TubShowr,WlkInCls","Curbs, Open Porch(es), Sidewalk, Storage Shed, Underground Lawn Sprinkler","Townhouse-End Unit, Custom Home, Multi Floor Unit",15x14,15x11,14x11,16x14,14x11,17x15,26x22,Yes,15x14,8,1,"Asphalt Shingle","Composition Siding",,0.15,,,,"Carbon Monoxide Detector, Dishwasher, Dryer, Generator-Built-In, Kitchen Exhaust Fan, Microwave Oven, Range/Oven-Gas, Refrigerator, Sump Pump, Washer",364200,*,525000,*,,*,,"Finished, Full","Stall Shower",Second,Second,Second,Third,3007,*,,,,,No,,,,,,29,*,*,,,Yes,"1 Car Width, Blacktop, Driveway-Shared",,Unknown,"Dining Chandeliar Excluded. Front bedroom curtain & rod excluded.",,,,,"Living Room, Wood Burning",Wood,"Attached,DoorOpnr,InEntrnc,Oversize",,Gas-Natural,48,"2024-03-06 12:35:48.0",5271592,40.64723,,,,"BHHS FOX & ROACH",973-538-5555,,-74.34476,"Level Lot",21,*,,7x6,,,,,,,,"Fee Simple",Yes,,,POT,,"Stunning newer attached home on tree lined street. 1 block walk to Westfield train station & vibrant downtown. Home boasts welcoming front porch ideal for sipping coffee or unwinding while enjoying the serene neighborhood.  Step inside to discover 9' ceilings that accentuate the exquisite millwork & elegantly arched doorways. Gorgeous hardwood floors can be found through out. The coffered ceiling in the dining room adds elegance! Prepare to be dazzled by the Gourmet Chef's kitchen!  42"" cabinetry, sleek quartz countertops and high end appliances include 5 burner Bertazzoni gas range.  Center island breakfast bar is perfect for casual meals. This kitchen is a master piece of both style & functionality.  Spacious Primary bedroom features walk in closet with built in cabinetry and private bath w/large custom tiled shower. Second floor has 2 additional bedrooms w/full bath. Private covered balcony off the 2nd floor bedroom provides a spot to enjoy the outdoors. Third floor offers private bedroom w/window seat, oversized closet & full bath.  The finished basement with full bath has high ceilings & provides a versatile space for various activities w/ample room for both relaxation & entertainment.  The attached garage enters on grade +2 more parking spots outside. Perennial flower garden add beauty & charm to this home creating a picturesque setting. The private side courtyard offers outdoor space for relaxing & entertaining.  Quality workmanship through out! No HOA fee.",07090,,,"Bath(s) Other, Family Room, Storage Room, Utility Room",,,"Formal Dining Room",First,Basement,,"Breakfast Bar, Center Island, Eat-In Kitchen, Pantry",First,First,"DiningRm,GarEnter,Kitchen,LivingRm,Pantry,Porch,PowderRm","3 Bedrooms, Bath Main, Bath(s) Other, Laundry Room","1 Bedroom, Bath(s) Other",,"Full Bath, Walk-In Closet","Laundry Room",Second,,,,,,,,"Cable TV Available","Public Sewer",,,2544,,509,*,"Townhouse-End Unit",,,19615,*,*,2.206,*,2023,2023,*,2920,*,*,Gas-Natural,,"Public Water",Gas,,Approximate,*,,Condo/Coop/Townhouse,Y,,"See Remarks",,,,No,,"2024-03-06 03:02:20.413",Active,"2024-03-04 09:54:15.0",Y,A,2024-03-06,N,N,201-572-7616
408,"Wilson St",,"Phillipsburg Town",08865-3218,,,,,,404924,,,,,,,000628,,2024-03-04,375000,,,,,"Coming Soon",,,Warren,"RT22 TO S.ON ROSBERRY TO R.ON HECKMAN TO LEFT ON WILSON STREET","2024-03-06 12:52:31.0",3888888,,,,,,,,,,,,,,,,,,,,,,PHILIPSBRG,PHILIPSBRG,PHILIPSBRG,3019-01320-0000-00005-0000-,,102400,3,1.00,1,0,,,".126 ACRE",2,,1950,"Forced Hot Air","Window A/C(s)",Yes,"Blinds,CODetect,Drapes,SmokeDet,StallShw","Deck, Enclosed Porch(es), Patio, Privacy Fence, Wood Fence","Colonial, Detached",16x11,13x7,7x9,,14x9,15x11,,Yes,14x9,9,0,"Asphalt Shingle","Vinyl Siding",,0.13,*,,,"Carbon Monoxide Detector, Dishwasher, Microwave Oven, Range/Oven-Gas, Refrigerator, Stackable Washer/Dryer",74000,*,28400,*,,*,,Partial,"Stall Shower",Second,Second,Second,,1320,*,,,,,No,,,,,,30,*,*,,,Yes,"2 Car Width, Driveway-Exclusive, Off-Street Parking",,No,,,,,,,"Carpeting, Laminate","Detached Garage",Yes,Gas-Natural,32,"2024-03-04 12:21:28.0",5273004,40.68975,,,,"WEICHERT REALTORS",908-454-1717,,-75.18512,,5,*,*,26x17,11x4,6x5,9x6,,,,,"Fee Simple",Yes,,"Above Ground",POT,Tan,"Nestled in the historic town of Phillipsburg, NJ, along the winding waters of the Delaware River, sits this quaint three-bedroom, one-bathroom colonial house filled with charm and character throughout. This home features many upgrades, including a newer roof, solid Hickory cabinets, granite countertops, all stainless steel appliances, and a breakfast bar area. A full dining room and living room with all wood and laminate flooring and Stainmaster carpeting throughout the upstairs. The first-floor laundry room is newly remodeled, featuring a new stacked washer and dryer, new flooring, and ample storage space. The basement is partially finished with plenty of space to expand. The second-floor full bath is all newly renovated with a new glass shower, tile floor, Sink, and toilet. The primary bedroom offers plenty of space to configure however you desire while providing easy access to the ample attic space. The remaining two bedrooms are also located on the second floor, perfect for the rest of the family or to utilize for guests. The fully fenced-in backyard offers ample space to play and entertain, entirely secluded for relaxation. Take a dip in the well-maintained above-ground pool or relax on the deck. Plenty of plants and shrubs darn the yard to provide vibrant color and beauty all spring and summer. The property boasts plenty of off-street parking and a 2-car detached garage to use or make Into your workshop or gardening central.",,,2020,"Den, Media Room",,Basement,"Formal Dining Room",First,,,"Breakfast Bar, Separate Dining Area",First,First,"DiningRm,Foyer,Kitchen,Laundry,LivingRm,SeeRem","3 Bedrooms, Bath Main",Attic,,,Attic,Third,Foyer,First,"Laundry Room",First,Bathroom,Second,,,"Public Sewer",,,,*,408,*,Colonial,No,,4296,*,*,4.196,*,2023,2023,*,3019,*,*,"Electric, Gas-Natural",,"Public Water",,,Approximate,*,,"Single Family",Y,,"See Remarks",,,,No,,"2024-03-04 09:58:46.686","Coming Soon","2024-03-04 09:58:47.0",Y,A,2024-03-07,N,N,646-300-2311
110,"HILLCREST DRIVE",,"Denville Twp.",07834-1400,,,,,,247769,,,,,,,4330,,2024-03-04,600000,,,,,Active,,,Morris,"Morris Ave to Kitchell Rd to Hillcrest Dr","2024-03-04 15:35:56.0",3888891,,,,,,,,,,,,,,,,,,,,,,Riverview,ValleyView,MorrisKnol,2308-61001-0000-00478-0000-,,313200,2,1.10,1,1,"Cedar Lake",,"1.177 AC",0,,1930,"3 Units, Baseboard - Hotwater, Heat Pump, Multi-Zone","3 Units, Ductless Split AC, Multi-Zone Cooling, Wall A/C Unit(s)",No,"Blinds,CODetect,FireExtg,SmokeDet,StallShw,TubShowr,WlkInCls","Deck, Patio, Storage Shed, Thermal Windows/Doors",Ranch,15x10,12x11,,,14x10,23x14,,Yes,15x10,5,1,"Asphalt Shingle","Vinyl Siding",,1.17,,,,"Dishwasher, Dryer, Generator-Hookup, Microwave Oven, Range/Oven-Electric, Refrigerator, Stackable Washer/Dryer, Sump Pump, Washer, Water Filter, Water Softener-Own",113100,*,200100,*,No,*,,"Crawl Space, Partial, Unfinished, Walkout",,First,First,,,61001,*,,,,,No,,,,"ClubHous,LakePriv,MulSport,Playgrnd",,23,*,*,,,Yes,"2 Car Width, Additional Parking, Off-Street Parking",,Unknown,,,,,,"Living Room, Wood Burning","Carpeting, Tile, Wood",,No,OilAbIn,46,"2024-03-04 10:55:49.0",5272799,40.91481,,,,"KELLER WILLIAMS METROPOLITAN",973-539-1120,,-74.47695,"Lake/Water View, Mountain View, Skyline View, Wooded Lot","476 & 478",,,,,,,Home-Office,,,,"Fee Simple",Yes,,,"At Closing",White,"Impeccable Ranch w/stunning Lake & NYC Skyline Views surrounded by Jonathan's Woods which includes 635 protected green acres & hiking trails. Truly an oasis of peace & privacy located in the Cedar Lake section of Denville - truly unique & captivating property. OVER 1 acre on quiet, dead end street. ONE FLOOR LIVING. Features include updated galley style kitchen with stainless steel appliances. NEW dishwasher & refrigerator. Separate dining area. Bright living room on the back of home. An abundance of windows throughout provide a beautiful ambience, tons of natural light & stunning views. Charming stone fireplace. 2 generous sized bedrooms. 1 Full and half bath. Clean and nicely updated baths.. The back deck is a priceless addition to this home, offers easy indoor/outdoor access & a quiet lifestyle. Perfect for entertaining or relaxation! TONS of Storage in unfinished bsmt. Off street parking. Enjoy the lovely and desirable Cedar Lake community- Clubhouse, beaches and boating! Tons of activities for all ages. Minutes to DWTN Denville -a vibrant DWTN with shopping, restaurants & events.  Experience tranquility & privacy right in your own backyard w/all the conveniences of NYC mass transit & easy access to major hwys. Tons of upgrades include new window units, washer/dryer, water softener ('21), well pump ('22), water heater, neutralizer system, water softener ('23) and BRAND NEW windows will be installed in LR & Kitchen March 2024. Septic is Town Verified for 3 BDRM.",07834,,2022,"Storage Room, Utility Room, Workshop",,Basement,"Living/Dining Combo",First,,,"Separate Dining Area",First,First,"2 Bedrooms, Bath Main, Kitchen, Living Room, Powder Room",Attic,,,"1st Floor",,,,,,,,,,"Cable TV Available","Private, Septic 3 Bedroom Town Verified",,,,,110,*,Ranch,No,,8284,*,*,2.645,*,2023,2023,*,2308,*,*,"Electric, See Remarks",No,"Private, Well",Electric,,"Approximate, Renovated",*,,"Single Family",Y,,"See Remarks",,,,No,,"2024-03-04 10:06:50.154",Active,"2024-03-04 10:06:50.0",Y,A,,N,N,973-539-1120
135,"Lincoln Ave",,"Elizabeth City",07208-1726,,,,,,303332,,,,,,,037903,,2024-03-04,659900,,,,,Active,,,Union,GPS,"2024-03-06 10:17:44.0",3888893,,,,,,,,,,,,,,,,,,,,,,,,,2904-00093-0000-00018-0000-,,46400,4,3.10,3,1,"Elmora Hills",,"198X115 AVG",1,5,1950,"2 Units, Forced Hot Air","2 Units, Central Air, Multi-Zone Cooling",,"CODetect,CeilCath,AlrmFire,JacuzTyp,SmokeDet,SoakTub,StallTub,Steam,WlkInCls","OutDrKit,ThrmlW&D,Sprinklr","Expanded Ranch, Custom Home",,,,,,,,Yes,,9,1,"Asphalt Shingle",Brick,,0.52,*,,,"Carbon Monoxide Detector, Dishwasher, Dryer, Generator-Built-In, Microwave Oven, Range/Oven-Gas, Refrigerator, Stackable Washer/Dryer, Sump Pump, Washer",21400,*,25000,*,,*,,"Finished, French Drain, Full","Jetted Tub, Sauna, Steam",First,First,First,Basement,93,*,,,,,No,,,,,,29,*,*,,,,"2 Car Width, Additional Parking, Driveway-Exclusive",,No,"basement stackable dryer/ washer and basement fridge",,,,,"Wood Burning","Tile, Wood","Detached Garage, Garage Door Opener",,Gas-Natural,49,"2024-03-06 10:17:44.0",5272950,40.67226,,,,"C-21 PREFERRED REALTY, INC",908-688-3311,,-74.22714,"Corner, Level Lot",18,*,*,,,,,,,,,"Fee Simple",,,,TBD,,"Welcome to Elmora Hills, where tranquility meets architectural brilliance. This home is unlike any other home you will find, As you enter the main level, you'll be greeted by soaring cathedral ceilings with floor-to-ceiling picture windows, inviting in streams of natural light. A dual focus living room featuring a wood-burning fireplace.The kitchen presents a breakfast bar with granite countertops, ample storage, and seamlessly transitions into a separate dining area that flows into a den. The primary suite offers a spacious retreat complete with a California closet and an open bathroom featuring a  steam Sauna/ shower and luxurious whirlpool tub. Completing the main floor are two additional bedrooms and a shared bathroom, powder room and laundry. Descend to the lower level to discover an in-law suite, boasting its own summer kitchen, full bathroom, and a separate entrance for added privacy. Nestled on a corner lot, the outdoor space is perfect for entertaining, featuring an outdoor kitchen and a spacious open area perfect for gatherings. Equipped with multi-cooling zones, this home seamlessly blends comfort and functionality, offering a sanctuary where every detail has been meticulously crafted for refined living.",,,2018,"1Bedroom,BathOthr,Laundry,LivDinRm,Utility,Walkout",,,"Formal Dining Room",First,First,,"Breakfast Bar, Separate Dining Area",First,First,"3 Bedrooms, Bath Main, Bath(s) Other, Den, Dining Room, Kitchen, Laundry Room, Living Room, Powder Room",,,,"Full Bath, Walk-In Closet",,,,,,,,,,,"Public Sewer",,,,*,135,*,"Expanded Ranch",Yes,"Bedroom1,FullBath,Kitchen,LivingRm,SepEnter",13938,,*,31.430,*,2023,2023,*,2904,*,*,"All Underground",,"Public Water",,,Approximate,*,,"Single Family",Y,,"See Remarks",,,,No,,"2024-03-04 10:12:54.962",Active,"2024-03-04 10:12:55.0",Y,A,,Y,Y,908-688-3311
337,"Hilltop Rd",,"Mendham Boro",07945-2908,,,,,,262041,,,,,,,000613,,2024-03-04,1100000,,,,,Active,,,Morris,"Rt 24 to Hilltop Rd, driveway entrance on Kerby; 1st driveway on left","2024-03-04 11:34:40.0",3888894,residential,,,,,,,,,,,,,,,,,,,,,Hilltop,MT.View,W.M.Mendham,2318-02201-0000-00011-0000-,,888200,4,3.10,3,1,"Estate location",,"5.001 AC",3,,1906,"1 Unit, Baseboard - Hotwater, Multi-Zone, Radiant - Electric","1 Unit, Central Air",No,"CeilBeam,Bidet,Blinds,CODetect,FireExtg,SecurSys,SmokeDet,StallShw,TubShowr,WlkInCls","Open Porch(es), Patio",Colonial,15x14,12x12,12x13,7x13,12x15,15x15,15x23,Yes,20x11,10,2,"Asphalt Shingle",Wood,,5.00,*,,,"Cooktop - Gas, Dishwasher, Dryer, Generator-Built-In, Microwave Oven, Refrigerator, Wall Oven(s) - Electric, Washer",248200,*,640000,*,No,*,,Unfinished,"Soaking Tub, Stall Shower",Second,Second,Second,Third,2201,*,,,,,No,,,,,,23,*,*,,,Yes,"1 Car Width, Additional Parking, Blacktop, Circular",,Unknown,"garage refrigerator",,,,,"Dining Room, Family Room, Wood Burning","Carpeting, Tile, Wood","Detached Garage, Garage Door Opener",No,Gas-Natural,40,"2024-03-04 10:55:36.0",5272969,40.75794,,,,"WEICHERT REALTORS",973-543-6511,,-74.60462,"Level Lot, Open Lot, Wooded Lot",11,*,*,10x8,15x20,7x9,,,,,,"Fee Simple",,,,POT,white,"Welcome to :Country Comfort"", an absolutely charming turn-of-the-century renovated farmhouse nestled privately on one of the most breathtaking properties you will find in Mendham, or arguably, anywhere.  Experience the quality of old world craftsmanship with the benefits of all of today's latest conveniences. 10 rooms including 4 airy bedrooms, 3 full baths, updated powder room, gorgeous renovated designer kitchen, open floor plan family room with fireplace and porch access, lovely living room has stunning built-in bookcases and pocket door opening to the elegant dining room featuring an attractive built-in china closet and handsome fireplace, new primary bedroom suite with superb bath and impressive dressing room, guest bedroom with private bath, and  expansive third floor bedroom.  Clean and dry sprawling basement, wide porch, paver patio, 3-car detached garage with heater, workshop and smokehouse, private circular driveway, updated HVAC systems, whole-house natural gas standby generator, and a stunning pancake-flat five acre showcase property.",07945,,2024,"Storage Room, Utility Room",,,"Formal Dining Room",First,First,,"Breakfast Bar, Center Island, Eat-In Kitchen, Pantry, Separate Dining Area",First,First,"Dining Room, Family Room, Foyer, Kitchen, Laundry Room, Living Room, Pantry, Powder Room","3 Bedrooms, Bath Main, Bath(s) Other, Office","1Bedroom,Leisure",,"Dressing Room, Full Bath, Walk-In Closet",Office,Second,"Leisure Room",Third,"Laundry Room",First,,,,"Cable TV Available, Fiber Optic, Garbage Extra Charge","Septic 4 Bedroom Town Verified",,,3000,*,337,*,Colonial,No,,21796,*,*,2.454,*,2023,2023,*,2319,*,*,"Electric, Gas-Natural",No,"Public Water",Gas,,Renovated,*,,"Single Family",Y,,"See Remarks",,,,No,,"2024-03-04 10:13:09.79",Active,"2024-03-04 10:13:09.0",Y,A,,N,N,201-317-6338
454,"Hill St",,"Boonton Town",07005-1260,,,,,,236651,,,,,,299739,037902,,2024-03-04,589000,,,,,"Coming Soon",,,Morris,"north main st to hillside ave to hill st","2024-03-04 15:54:37.0",3888896,,,,,,,,,,,,,,,,,,,,,,"John Hill","John Hill",Boonton,2301-00024-0000-00019-0026-C0026,,320900,3,2.10,2,1,"Spruce Hill",400,510X300,2,2,1985,"1 Unit, Forced Hot Air","1 Unit, Central Air",,,"Deck, Sidewalk","Townhouse-Interior, Multi Floor Unit",,,,,,,,Yes,,7,1,"Asphalt Shingle",Wood,,0.00,*,,395,"Carbon Monoxide Detector, Dishwasher, Dryer, Microwave Oven, Range/Oven-Gas, Refrigerator, Washer",200900,*,120000,*,,*,Monthly,"Finished-Partially, Full, Walkout",,,,,,24,*,,,,,Yes,,,,,,23,*,*,,,Yes,"2 Car Width, Additional Parking",Common,Yes,,,"Snow Removal, Trash Collection",800,"One Time","Living Room",,"Built-In Garage, Garage Door Opener, Oversize Garage",,Gas-Natural,17,"2024-03-04 10:55:02.0",5271838,40.91206,,,,"C-21 PREFERRED REALTY, INC",973-838-3600,,-74.41827,"Level Lot, Wooded Lot",19.26,*,*,,,,,,,,,Condominium,"Call, Number Limit, Yes",,,immed,Brown,"This is an updated 3 bedroom  2.5 baths, open floor plan townhouse. First floor offers Formal dining room with sliders to deck, Large Living room with fireplace and sliders to deck, separate Kitchen with granite counter tops and tiled backsplash Gourmet eating area with garden window, Powder room.  Bedroom/Den. Second floors offers Master suite is large with wall of glass sliders to private deck en suite bath with large soaking tub and separate stall shower, Bedroom with en suite bath.  Lower level offers Den/Exersize /Media room, Extra large laundry room and 2 car garage.  Move in ready,  flooded with natural sun light,",07005,,,,,,,,,,"Breakfast Bar",,,,,,,,,,,,,,,,,,"Public Sewer",,,1781,*,454,*,Townhouse-Interior,,,10560,*,*,3.291,*,2023,2023,*,2301,*,*,"All Underground",,"Public Water",,,Approximate,*,,Condo/Coop/Townhouse,Y,,"See Remarks",,,,No,,"2024-03-04 10:17:00.159","Coming Soon","2024-03-04 10:17:00.0",Y,A,2024-03-07,Y,Y,973-838-3600
