STREETNUMBER,STREETNAME,UNITNUMBER,CITY,POSTALCODE,AGENTFIRSTNAME,AGENTLASTNAME,AGENTOFFICEPHONE,AGENTPHONE,AGENTPAGER,AGENTID,AGENT2LISTFIRSTNAME,AGENT2LISTLASTNAME,AGENT2LISTOFFICEPHONE,AGENT2LISTPHONE,AGENT2LISTPAGER,AGENTCOLIST,OFFICEID,OFFFICEBROKERID,LISTDATE,LISTPRICE,EXPIRATIONDATE,SHOWINGINSTRUCTIONS,LISTINGTYPE,REMARKS,LISTINGSTATUS,ORIGINALLISTPRICE,DAYSONMARKET,COUNTY,DIRECTIONS,LASTMODIFIED,LISTINGID,ZONING,SELLAGENTFIRSTNAME,SELLAGENTLASTNAME,SELLAGENTOFFICEPHONE,SELLAGENTPHONE,SELLAGENTPAGER,AGENTSELL,SELLAGENT2FIRSTNAME,SELLAGENT2LASTNAME,SELLAGENT2OFFICEPHONE,SELLAGENT2PHONE,SELLAGENT2PAGER,AGENTCOSELL,OFFICESELLNAME,OFFICESELLPHONE,OFFICESELLFAX,OFFICESELL,OFFICESELLBROKERID,CONTRACTDATE,CLOSEPRICE,CLOSEDATE,ELEMENTARYSCHOOL,MIDDLESCHOOL,HIGHSCHOOL,TAXID,OWNERSNAME,TAXASSESSEDVALUATION,BEDS,BATHS,BATHSFULL,BATHSHALF,SUBDIVISION,ASSOCIATIONFEE,LOTSIZE,GARAGE,OPENPARKING,YEARBUILT,HEATING,COOLING,POOL,INTERIORFEATURES,EXTERIORFEATURES,STYLE,BEDROOM1DIM,BEDROOM2DIM,BEDROOM3DIM,BEDROOM4DIM,DININGROOMDIM,LIVINGROOMDIM,FAMILYROOMDIM,BASEMENT,KITCHENDIM,TOTALROOMS,FIREPLACES,ROOF,EXTERIOR,ARIP,ACRES,ACRESTAX,ANTICCLOSEDDATE,APPFEE,APPLIANCES,ASSESSAMOUNTBLDG,ASSESSAMOUNTBLDGTAX,ASSESSAMOUNTLAND,ASSESSAMOUNTLANDTAX,ASSESSFARM,ASSESSTOTALTAX,ASSOCFEEFREQ,BASEDESC,BATHSDESC,BED1LEVEL,BED2LEVEL,BED3LEVEL,BED4LEVEL,BLOCKID,BLOCKIDTAX,BUILDINGNUM,BUSRELATION,COLISTAGENTNAME,COSELLAGENTNAME,COMMLIVING,COMPBUY,COMPSELL,COMPTRANS,COMPLEXFEATURES,CONDOMINIUM,COUNTYCODE,COUNTYCODETAX,COUNTYTAX,DOMACT,DOMCOMP,DISCLOSUREAVAIL,DRIVEWAYDESC,EASEDESC,EASEMENT,EXCLUSIONS,FARM,FEEINCLUDES,FEEOTHER,FEEOTHERFREQ,FIREPLACEDESC,FLOORS,GARAGEDESC,HANDICAP,HEATSRC,IMAGECOUNT,IMAGEDATE,LSTNGSYSID,LATITUDE,LISTAGENTNAME,LISTAGENTPHONE,LISTOFFICEFAX,LISTOFFICENAME,LISTOFFICEPHONE,LOANTERMS,LONGITUDE,LOTDESC,LOTID,LOTIDTAX,LOTSIZETAX,OTHERROOM1DIM,OTHERROOM2DIM,OTHERROOM3DIM,OTHERROOM4DIM,OTHERUSE,OUTOFCOUNTY,OWNERNAMETAX,OWNERPHONE,OWNERSHIPTYPE,PETS,PHOTOINSTR,POOLDESC,POSSESSION,PROPCOLOR,PUBLICREMARKS,RCOMZIP,REMARKSPUBADD,RENOVATED,ROOMBASELVLDESC,ROOMDENDIM,ROOMDENLEVEL,ROOMDININGDESC,ROOMDININGLEVEL,ROOMFAMILYLEVEL,ROOMGROUNDLVLDESC,ROOMKITCHENDESC,ROOMKITCHENLEVEL,ROOMLIVINGLEVEL,ROOMLVL1DESC,ROOMLVL2DESC,ROOMLVL3DESC,ROOMLVLOTHERDESC,ROOMMASTERBEDDESC,ROOMOTHER1,ROOMOTHER1LEVEL,ROOMOTHER2,ROOMOTHER2LEVEL,ROOMOTHER3,ROOMOTHER3LEVEL,ROOMOTHER4,ROOMOTHER4LEVEL,SELLAGENTNAME,SERVICES,SEWER,SHOWSPECIAL,SIGN,SQFTAPPROX,STREETNAMETAX,STREETNUMDISPLAY,STREETNUMTAX,STYLEPRIMARY,SUITE,SUITEDES,TAXAMOUNT,TAXAMOUNTTAX,TAXIDTAX,TAXRATE,TAXRATETAX,TAXRATEYEAR,TAXYEAR,TAXYEARTAX,TOWNCODE,TOWNCODETAX,TOWNTAX,UTILITIES,WARRANTY,WATER,WATERHEATER,WITHDRAWNDATE,YEARBUILTDESC,ZIPCODETAX,LENDERAPPROVAL,SUBPROPTYPE,ADDRESSINCLUDED,LISTTYPERESO,POSSESSIONRESO,ASSOCMGMTNAME,ASSOCMGMTPHONE,CONFIDENTIALINCLUDED,FHAAGERESTR,FLOORNUM,MAJORCHANGETIMESTAMP,MLSTATUS,ORIGINALENTRYDATETIME,REQUIREOFFICEINFO,AGENTOFFICEFEED,FIRSTSHOWINGDATE,INTERNETCONSUMERCOMMENTYN,INTERNETAUTOMATEDVALUATIONDISPLAYYN,ATTRIBUTIONCONTACT
19,"Tall Timber Dr",,"Morris Twp.",07960-2616,,,,,,255502,,,,,,,2792,,2024-02-28,899900,,,,,Active,,,Morris,"Sussex Avenue to Lake Road to Tall Timber #19","2024-03-05 14:18:42.0",3888244,,,,,,,,,,,,,,,,,,,,,,K-2;3-5,Frelghuysn,"MTWN 9-12",2322-01701-0000-00004-0000-,,653900,4,2.20,2,2,"The Summit",,".96 AC",2,4,1975,"1 Unit, Forced Hot Air","1 Unit",No,"CODetect,CeilCath,CedrClst,FireExtg,CeilHigh,SmokeDet,StallShw,TubShowr","Curbs, Patio, Storm Door(s), Thermal Windows/Doors, Wood Fence",Colonial,17x13,18x12,16x10,14x13,14x14,20x15,20x16,Yes,25x14,11,1,"Asphalt Shingle","Stone, Wood Shingle",,0.96,*,,,"Carbon Monoxide Detector, Dishwasher, Dryer, Generator-Built-In, Kitchen Exhaust Fan, Range/Oven-Gas, Refrigerator, Self Cleaning Oven, Sump Pump, Wall Oven(s) - Gas, Washer",345900,*,308000,*,No,*,,"Finished, Full","Stall Shower",Second,Second,Second,Second,1701,*,,,,,No,,,,,,23,*,*,,,Yes,"1 Car Width, 2 Car Width, Blacktop",,Unknown,None,,,,,"Family Room, Wood Burning","Carpeting, Stone, Tile, Wood","Attached Garage, Garage Door Opener",No,Gas-Natural,27,"2024-02-29 08:28:42.0",5272387,40.82439,,,,"KELLER WILLIAMS REALTY",908-273-2991,,-74.51167,"Level Lot",4,*,*,11x7,31x28,14x6,14x13,,,,,"Fee Simple",Yes,,,Poss,Brown,"A Grand Center Hall Colonial (Tudor Style) on .94 Acre beaming w/natural sunlight. Two-story foyer, Hardwood fl under 2nd fl carpet & wood fl in FR & LR. Kitchen(25x14) renovated in 2015w/custom cabinetry, double wall oven, granite countertops, slider leading to the private, quiet bluestone patio, surrounded by mature trees & perennials.Whole House Generator (2023), New Electrical Panel (2023),Two car attached garage off of kit and 1st-floor laundry rm w/exterior door leading to the backyard. FR (20x16) w/wood-burning fireplace w/built-in cabinetry on the right/left of it and a beautiful custom window seat overlooking the serene backyard through the casement windows.The LR (20x15) has wood floors and beautiful casement windows. The DR (14x14) is perfect for entertaining! Recessed lights throughout. Upstairs, the bedrooms are extremely spacious (hardwood under the carpet except primary dressing area). Primary BR has gleaming wood floors with an en suite just waiting for an outstanding renovation. Full main BA w/ a tub/shower & double sink vanity. Upstairs hall banister overlooks the two-story foyer. Fully Finished Basement with wood cabinetry and recessed lights. Spacious utility & storage room. Half bath and cedar closet complements the rec room. Driveway w/ Belgian block curbing. The sprawling front lawn leads up to a very special home in an outstanding neighborhood w/ cul-de-sac. Close to Midtown Direct Morristown Train Station, Convent Station Train Station w/parking.",,,2015,"Powder Room, Rec Room, Storage Room, Utility Room, Workshop",,,"Formal Dining Room",First,First,,"Center Island, Eat-In Kitchen",First,First,"DiningRm,FamilyRm,Foyer,GarEnter,Kitchen,Laundry,LivingRm,PowderRm","4 Or More Bedrooms, Bath Main, Bath(s) Other",,GarEnter,"Full Bath",SittngRm,Second,"Rec Room",Second,"Laundry Room",First,Foyer,First,,"Cable TV Available, Garbage Included","Public Sewer",,,2800,*,19,*,Colonial,No,,13110,*,*,2.005,*,2023,2023,*,2324,*,*,Gas-Natural,No,"Public Water",Gas,,Approximate,*,,"Single Family",Y,,"See Remarks",,,,No,,"2024-02-28 23:01:48.1",Active,"2024-02-28 23:01:48.0",Y,A,,Y,Y,973-476-7115
393,"White St",,"City Of Orange Twp.",07050-2705,,,,,,272046,,,,,,,059101,,2024-02-29,350000,,,,,Active,,,Essex,"Main Street to White Street or 280 HWY to West Orange exit to Mt Pleasant to White Street. Near West Orange Border.","2024-03-06 15:30:10.0",3888250,,,,,,,,,,,,,,,,,,,,,,CENTRAL,,ORANGE,1617-01501-0000-00009-0000-,,228900,3,1.10,1,1,Downtown,,"3630 SF",2,6,1959,"1 Unit","Window A/C(s)",,,,"Colonial, 1/2 Duplex",14x12,11x13,9x11,,11x14,17x15,17x36,Yes,11x14,8,0,"Asphalt Shingle","Composition Siding",,0.08,*,,,"Carbon Monoxide Detector, Dryer, Range/Oven-Gas, Refrigerator, Washer",140300,*,88600,*,,*,,"Full, Unfinished, Walkout",,Second,Second,Second,,1501,*,,,,,No,,,,,,16,*,*,,,,"2 Car Width",,Unknown,,,,,,,Wood,"Detached Garage",,Gas-Natural,31,"2024-02-29 12:01:03.0",5269977,40.77629,,,,"BHHS JORDAN BARIS REALTY",973-736-1600,,-74.23086,,9,*,*,12x12,7x11,,,Home-Office,,,,"Fee Simple",,,,T/B/D,Yellow,"This home is located in a prime location at the W Orange Border, just steps away from the W Orange AND the Orange Town Hall, near shops and restaurants. Step into the spacious & inviting living room that opens to the dining room-ideal for entertaining and the enjoyment of meals. From the kitchen, you will enjoy the convenience of immediate access to the enclosed porch/sunroom, creating a seamless transition between indoor & outdoor living space. An updated powder room & pantry complete the first floor. The upper level has a good size primary, two additional B/R's and a main bath complete the 2nd flr. There are hardwood floors throughout the home. Discover endless possibilities in the walk-out unfinished lower level, boasting high ceilings & phenomenal open space. Whether you envision a recreational retreat, a cozy family rm, or a multifunctional entertainment area, this huge versatile space awaits your personal touch. The laundry rm, utility rm & storage galore, complete the lower level. This home also has a 2 car garage w/ample driveway. With its unbeatable combination of value, location AND LOW LOW Taxes -- This home presents an exceptional opportunity for a Buyer. Walking distance to shops & trans. to NYC.  Truly a Commuter's Delight. This home qualifies for Community Advantage program w/No PMI/No income limitations for Borrowers and only 5% Down Payment. A touch of tender loving care (TLC) is all this home needs to make it your perfect home. This home is being sold AS IS.",07050,,,"Family Room, Laundry Room, Utility Room, Walkout",,,"Formal Dining Room",First,Basement,,"Eat-In Kitchen",First,First,"Dining Room, Foyer, Kitchen, Living Room, Office, Pantry, Powder Room, Sunroom","3 Bedrooms, Bath Main",,,,Sunroom,First,"Laundry Room",Basement,,,,,,"Cable TV Available","Public Sewer",,,,*,393,*,Colonial,,,7933,*,*,3.466,*,2022,2022,*,1617,*,*,"Electric, Gas-Natural",,"Public Water",Gas,,Approximate,*,,"Single Family",Y,,"See Remarks",,,,No,,"2024-02-29 00:03:31.878",Active,"2024-02-29 00:03:32.0",Y,A,,N,N,973-736-1600
84,"Cemetery Hill Rd",,"Washington Twp.",07882-4023,,,,,,306358,,,,,,,5849,,2024-02-29,480000,,,,,"Under Contract",,,Warren,"31N, left on Rymon Rd, R onto Cemetery Hill Rd; corner of Cemetery Hill Rd and Dogwood Dr.","2024-03-05 08:19:21.0",3888254,,,,,,,,,,,,,,,,,,,,,,"BRASS CSTL",WARRNHILLS,WARRNHILLS,3022-00067-0000-00006-0000-,,311400,4,2.00,2,0,,,"270 FF IRR   1.11 AC",2,,1961,"1 Unit, Baseboard - Hotwater, Multi-Zone","Wall A/C Unit(s), Window A/C(s)",,,"Deck, Patio","Expanded Ranch",,,,,,,,Yes,,8,2,"Asphalt Shingle","Brick, Wood",,1.11,*,,,"Carbon Monoxide Detector, Dishwasher, Range/Oven-Gas, Refrigerator",229700,*,81700,*,,*,,"Finished-Partially, Full, Walkout",,First,First,First,First,67,*,,,,,No,,,,,,30,*,*,,,Yes,"2 Car Width, Additional Parking, Blacktop",,Unknown,,,,,,"Living Room, Pellet Stove, See Remarks, Wood Burning","Laminate, Wood","Attached Garage, Oversize Garage",,Gas-Natural,33,"2024-02-29 08:28:50.0",5272290,40.74326,,,,"KELLER WILLIAMS INTEGRITY",973-726-0088,,-74.98986,"Corner, Open Lot",6,*,*,,,,,,,,,"Fee Simple",,,,"At Closing",Brick,"A seamless blend of style, comfort and charm are waiting for you in this fully updated 4 bedroom 2 full bath home! The striking 3 sided wood burning fireplace is the perfect accent to the newly installed panoramic windows allowing for an abundance of natural light to flood the main living area. An updated kitchen with siltstone quartz counters, recessed lighting, new backsplash and newer appliances is sure to please the most discerning of chefs. Both bathrooms were recently updated with no detail overlooked! The partially finished basement and pellet stove provide an additional year round entertaining space. The massive workshop is every handy-person's dream. Oversized 2 car garage as well as a spacious utility/storage area complete the ground level. Boundless storage throughout this home, gleaming hardwood floors, new roof in 2017, and a newer natural gas boiler. The excitement of this special home extends outside to the 1+ acre property offering a brick paver walkway, outdoor patio and spacious deck. Easy access to 31, 78, 57, 80 and 46.",,,,"FamilyRm,GarEnter,Storage,Utility,Workshop",,,,First,Basement,,"Breakfast Bar, Separate Dining Area",First,First,"4 Or More Bedrooms, Bath Main, Bath(s) Other, Dining Room, Kitchen, Living Room, Office, Pantry, Porch",,,,"1st Floor, Full Bath",,,,,,,,,,,Septic,,,,*,84,*,"Expanded Ranch",,,12561,*,*,4.034,*,2023,2023,*,3022,*,*,Gas-Natural,,Well,,,Approximate,*,,"Single Family",Y,,"See Remarks",,,,No,,"2024-03-05 08:19:21.308","Under Contract","2024-02-29 06:36:03.0",Y,A,2024-03-02,Y,Y,973-726-0088
221,"N Maple Ave",,"East Orange City",07017-4465,,,,,,241541,,,,,,,0390,,2024-02-29,399900,,,,,Active,,,Essex,"Park to North Maple","2024-03-05 06:20:09.0",3888256,,,,,,,,,,,,,,,,,,,,,,,,,1605-00261-0000-00028-0000-,,141800,4,1.10,1,1,,,30X131,0,6,1920,"1 Unit, Forced Hot Air","1 Unit, Central Air",,"Carbon Monoxide Detector, Fire Extinguisher, Smoke Detector",Patio,Colonial,,,,,,,,Yes,,7,0,"Asphalt Shingle","Vinyl Siding",,0.09,*,,,"Carbon Monoxide Detector, Range/Oven-Gas, Refrigerator",74100,*,67700,*,,*,,"Unfinished, Walkout",,Second,Second,Second,Third,261,*,,,,,No,,,,,,16,*,*,,,,"1 Car Width",,Unknown,,,,,,,Vinyl-Linoleum,,,Gas-Natural,22,"2024-02-29 08:28:20.0",5272023,40.76497,,,,"CENTURY 21 THE CROSSING",973-227-7000,,-74.20358,"Level Lot",28,*,*,,,,,,,,,"Fee Simple",,,,tbd,,"Fully renovated Colonial Kitchen with granite counters newer bathrooms enclosed front porch 3 bedrooms on 2nd floor 3rd floor features 4th bedroom or office full basement new HVAC and Central Air large driveway and patio",07017,,2023,"Laundry Room, Utility Room, Walkout",,,"Formal Dining Room",First,,,"Eat-In Kitchen",First,First,"Bath(s) Other, Dining Room, Kitchen, Living Room, Porch","3 Bedrooms, Bath Main","1 Bedroom",,,"Laundry Room",Basement,Porch,First,"Utility Room",Basement,,,,,"Public Sewer",,,,*,221,*,Colonial,,,4492,*,*,3.168,*,2023,2023,*,1605,*,*,"Electric, Gas-Natural",,"Public Water",Gas,,Renovated,*,,"Single Family",Y,,"See Remarks",,,,No,,"2024-03-03 03:02:21.312",Active,"2024-02-29 06:57:03.0",Y,A,2024-03-03,N,N,973-227-7000
60,"Arch St",,"Butler Boro",07405-1002,,,,,,267851,,,,,,,4421,,2024-02-29,359900,,,,,"Coming Soon",,,Morris,"Hamburg Tpke to Main St to Arch St","2024-03-06 13:56:14.0",3888257,res,,,,,,,,,,,,,,,,,,,,,Butler,Butler,Butler,2303-00025-0000-00047-0000-,,282200,2,2.00,2,0,,,37X125,0,2,9999,"Baseboard - Hotwater","Window A/C(s)",No,"Carbon Monoxide Detector, Fire Extinguisher, Smoke Detector","Deck, Open Porch(es)",Colonial,,,,,,,,Yes,,5,0,"Asphalt Shingle","Aluminum Siding, Vinyl Siding",,0.10,*,,,"Dishwasher, Microwave Oven, Range/Oven-Gas, Refrigerator",117800,*,164400,*,No,*,,Unfinished,,Second,Second,,,25,*,,,,,No,,,,,,23,*,*,,,Yes,"1 Car Width",,No,"Washer/dryer, refrigerator, and 4 window AC units negotiable",,,,,,"Carpeting, Laminate, Tile",,No,Gas-Natural,18,"2024-03-06 13:56:14.0",5267400,41.00653,,,,"HIGHMARK REAL ESTATE",973-625-8175,,-74.33719,"Level Lot",47,*,*,,,,,,,,,"Fee Simple",Yes,,,"at closing",Cream,"Beautiful Colonial renovated in 2014, features 2 full bedrooms, both with walk-in closets, and 2 full bathrooms, a remodeled kitchen and formal dining room, laundry room and mud room all in a lovely neighborhood in the highly desirable town of Butler. This home features an open porch in front, and a large deck in back for entertaining that overlooks a level backyard with a scenic, peaceful view of the Pequannock River.",07405,,2014,,,,"Formal Dining Room",First,,,"Separate Dining Area",First,First,"BathOthr,DiningRm,Kitchen,Laundry,LivingRm,MudRoom","2 Bedrooms, Bath Main",,,,"Laundry Room",,MudRoom,,,,,,,"Cable TV Available","Public Sewer",,,,*,60,*,Colonial,No,,7489,*,*,2.654,*,2023,2023,*,2303,*,*,"Gas In Street, Gas-Natural",No,"Public Water",Gas,,Approximate,*,,"Single Family",Y,,"See Remarks",,,,No,,"2024-02-29 07:04:44.212","Coming Soon","2024-02-29 07:04:44.0",N,A,2024-03-09,N,N,973-625-8175
140,"Howland Ave",,"River Edge Boro",07661-1707,,,,,,399656,,,,,,,5028,,2024-02-26,725000,,,,,Active,,,Bergen,"Kinderkamack Rd or Forest Ave to Howland Ave","2024-03-05 09:09:28.0",3888262,,,,,,,,,,,,,,,,,,,,,,,,,1152-01002-0000-00045-0000-,,373000,4,2.00,2,0,,,"80 X 104",0,,1917,"Multi-Zone, See Remarks","Central Air, Multi-Zone Cooling",,,,Colonial,,,,,,,,Yes,,8,1,"Asphalt Shingle",Stucco,,0.19,*,,,"Dishwasher, Dryer, Microwave Oven, Range/Oven-Electric, Refrigerator, Washer",169800,*,203200,*,,*,,"Finished, Full",,,,,,1002,*,,,,,No,,,,,,11,*,*,,,,"2 Car Width, Driveway-Exclusive",,No,,,,,,"Living Room, Wood Burning",,,,"Electric, See Remarks",26,"2024-02-29 08:28:34.0",5272411,40.91989670703196,,,,"EXP REALTY, LLC",866-201-6210,,-74.03821051018896,,45,*,*,,,,,,,,,"Fee Simple",,,,0-30,,"Must see 4 bedroom, 2 bathroom Colonial home located in the highly sought after Cherry Hill section of River Edge. Walking distance toCherry Hill ES, Cherry Blossom Park and Van Saun County Park. Commuters dream, close to NYC Express Bus and New Bridge LandingTrain Station. This bright colonial with a two-car driveway was fully renovated in 2022, including a new roof. Come unwind on the lemonadeporch! Entrance leads to an open living room area with a wood-burning fireplace, large dining room, kitchen features new stainless steelappliances and counter seating. Rear entrance of the home features a patio and faces a cul-de-sac. Two bedrooms, a full bathroom andlaundry room complete this first level. Hardwood floors throughout and high ceilings! The second level features another full-bathroom, twoadditional bedrooms, a family room and office.",,,2022,,,,,,,,"Eat-In Kitchen, Separate Dining Area",,,,,,,,,,,,,,,,,,"Public Sewer",,,1934,*,140,*,Colonial,,,13801,,*,3.866,*,2023,2023,,1152,*,*,"See Remarks",,"Public Water",,,Renovated,*,,"Single Family",Y,,"See Remarks",,,,No,,"2024-02-29 07:43:46.685",Active,"2024-02-29 07:43:47.0",Y,A,,N,N,201-527-8479
515,"Andria Ave",189,"Hillsborough Twp.",08844-4833,,,,,,280134,,,,,,,008302,,2024-02-29,215000,,,,,Active,,,Somerset,"Route 206 to Andria Avenue, Building 515, Unit 189 is located around the back of the building.","2024-03-04 06:29:39.0",3888264,,,,,,,,,,,,,,,,,,,,,,,HILLSBORO,HILLSBORO,2710-00153-0007-00068-0001-C0189,,165700,1,1.00,1,0,Alexandria,376,0.00,0,,1978,"Baseboard - Hotwater","Wall A/C Unit(s)",Yes,"Blinds,CODetect,SmokeDet,TubShowr","Curbs, Deck, Sidewalk","One Floor Unit, First Floor Unit",19x10,,,,9x8,19x13,,No,10x8,4,0,"Asphalt Shingle","Brick, Vinyl Siding",,0.00,*,,,"Carbon Monoxide Detector, Dishwasher, Dryer, Microwave Oven, Range/Oven-Electric, Refrigerator, Washer",85700,*,80000,*,No,*,Monthly,,,First,,,,153.07,*,515,,,,Yes,,,,,,27,*,*,,,Yes,Common,,Unknown,,,"Heat, Maintenance-Common Area, Maintenance-Exterior, Trash Collection, Water Fees",,,,,,No,Gas-Natural,12,"2024-02-29 08:28:04.0",5272182,40.51237,,,,"RE/MAX PREFERRED PROFESSIONALS",908-874-3308,,-74.63723,"Level Lot",68.01,*,,,,,,,,,,Condominium,Yes,,"Association Pool",Negotiable,Brick/Tan,"Enjoy the ease and comfort of one floor living in this unit located on the first level of the Alexandria development within close proximity to all shopping, transportation, dining and schools.This unit boasts a plethora of upgrades throughout, promising both comfort and style. Recently renovated kitchen with modern white shaker style cabinets, quartz countertops, and stainless steel Whirlpool appliances. Renovated bathroom with classic touches, hardwood flooring throughout, closet organizers in every closet maximizing the storage space, LG Front Loader Washer & Dryer conveniently installed in the hallway closet, newer A/C units, all windows and slider replaced, upgraded electrical box, recessed lighting and neutral paint throughout.  Extra storage space available in community shared basement.  Heat, water, trash,maintenance of exterior and common areas, tennis courts, playground and swimming pool all included with monthly association fee.",08844,,,,,,"Living/Dining Combo",First,,,"Not Eat-In Kitchen",First,First,"1 Bedroom, Bath Main, Dining Room, Kitchen, Living Room",,,,"1st Floor",,,,,,,,,,"Cable TV Available, Garbage Included","Public Sewer",,,873,*,515,*,"One Floor Unit",No,,3567,*,*,2.153,*,2023,2023,*,2710,*,*,Electric,No,"Association, Public Water, See Remarks","See Remarks",,Approximate,*,,Condo/Coop/Townhouse,Y,,"See Remarks",,,,No,,"2024-02-29 07:48:41.377",Active,"2024-02-29 07:48:41.0",Y,A,,N,N,908-642-2222
533,"Edward St",,"Lopatcong Twp.",08865-1988,,,,,,306130,,,,,,,3835,,2024-02-29,365000,,,,,Active,,,Warren,"78W to exit 3, (22W). Stay on 22W for 1.5 miles. Turn right on 1st St. Follow 1st St. to end & merge onto Edward Street.","2024-03-06 12:47:46.0",3888265,,,,,,,,,,,,,,,,,,,,,,,,,3015-00085-0002-00044-0000-,,322500,2,2.10,2,1,"Delaware Crossing",345,".10 ACRE",2,2,2008,Multi-Zone,"Central Air",Yes,"CODetect,CeilHigh,SmokeDet,SoakTub,StallShw,StallTub","Curbs, Patio, Sidewalk, Underground Lawn Sprinkler",Colonial,,,,,,,,No,,7,0,"Asphalt Shingle","Vertical Siding",,0.10,*,,,"Carbon Monoxide Detector, Cooktop - Gas, Dishwasher, Dryer, Microwave Oven, Range/Oven-Gas, Refrigerator, Self Cleaning Oven, Washer",225000,*,97500,*,,*,Monthly,,"Soaking Tub, Stall Shower",First,Second,,,85.02,*,,,,,Yes,,,,"Billiards Room, Club House, Exercise Room, Kitchen Facilities, Pool-Outdoor, Tennis Courts",,30,*,*,,,No,"2 Car Width",,Unknown,,,"Maintenance-Common Area, Maintenance-Exterior, See Remarks, Snow Removal, Trash Collection",,,,"Carpeting, Laminate, Tile","Attached Garage",,Gas-Natural,2,"2024-03-06 12:47:46.0",5272414,40.70645,,,,"RAIDER REALTY CORP.",908-874-8686,,-75.17261,,44,*,*,,,,,,,,,"Fee Simple","Cats OK, Dogs OK, Number Limit, Size Limit, Yes",,"Association Pool","March 2024",,,08865,,,,,,,First,First,"Breakfast Room, Dining Room, Foyer, Kitchen, Living Room, Powder Room","Eat-In Kitchen",First,,,"1 Bedroom, Bath Main, Loft, Utility Room",,,"1st Floor, Full Bath",Loft,Second,,First,Breakfast,,,,,"Cable TV Available, Garbage Included","Public Sewer",,,1900,*,533,*,Colonial,,,9220,*,*,2.859,*,2023,2023,*,3015,*,*,"All Underground, Gas-Natural",No,"Public Water","From Furnace",,Standing,*,,"Single Family",Y,,"See Remarks",,,,Yes,,"2024-02-29 07:56:42.746",Active,"2024-02-29 07:56:43.0",Y,A,,N,N,908-874-8686
5,"Sylvia Pl",,"Randolph Twp.",07869-4604,,,,,,285526,,,,,,,009902,,2024-02-29,395000,,,,,"Coming Soon",,,Morris,"Sussex Tpke to Musiker Ave to Sylvia Pl or Brookside Rd to Knightsbridge Dr to Musiker Ave to Sylvia","2024-03-06 10:10:58.0",3888268,,,,,,,,,,,,,,,,,,,,,,Shongum,Randolph,Randolph,2332-00122-0000-00010-0000-,,276100,2,1.00,1,0,,,".344 AC",0,2,1950,"1 Unit, Forced Hot Air","Window A/C(s)",No,"CODetect,FireExtg,SmokeDet,TubShowr",,Ranch,11x12,10x12,,,,18x15,,Yes,9x16,4,1,"Asphalt Shingle","Aluminum Siding",,0.34,*,,,"Dishwasher, Dryer, Freezer-Freestanding, Range/Oven-Electric, Refrigerator, Sump Pump, Washer",92300,*,183800,*,No,*,,"French Drain, Full, Unfinished",,First,First,,,122,*,,,,,No,,,,,,23,*,*,,,Yes,"1 Car Width",,Unknown,"Bathroom mirror, stair runner to basement",,,,,"Living Room, Wood Burning","Tile, Wood",None,No,OilAbIn,30,"2024-02-29 09:43:17.0",5269331,40.82066,,,,"TURPIN REAL ESTATE, INC.",973-543-7400,,-74.56347,"Level Lot",10,*,*,,,,,,,,,"Fee Simple",Yes,,,POT,White,"Charming renovated/updated 1950s cabin on .34 acres in convenient Knightsbridge area location. Perfect alternative to townhome living. Living area is anchored by painted hardwood walls and an original fieldstone wood burning fireplace. Two bedrooms with updated bath. Hardwood floors throughout. Kitchen features granite countertops, custom banquette and over looks level backyard. Three seasons room on rear of home perfect for an office. Four year old roof. Public sewer. Unfinished basement. Easy access to Sussex Turnpike and Morristown.",07869,,2020,,,,,,,Sunroom,"Eat-In Kitchen",First,First,"2 Bedrooms, Kitchen, Living Room",,,,"1st Floor",Sunroom,Ground,,,,,,,,"Cable TV Available","Public Sewer",,,825,*,5,*,Ranch,No,,7620,*,*,2.760,*,2023,2023,*,2332,*,*,Electric,No,Well,Electric,,Renovated,*,,"Single Family",Y,,"See Remarks",,,,No,,"2024-02-29 08:23:44.744","Coming Soon","2024-02-29 08:23:45.0",Y,A,2024-03-08,N,N,info@turpinrealtors.com
