140,"Montrose St",,"Newark City",07106-2314,,,,,,293331,,,,,,,002450,,2024-03-04,530000,,,,,"Coming Soon",,,Essex,"SOUTH ORANGE AVE TO MONTROSE TO CORNER OF VARSITY","2024-03-04 23:35:16.0",3889054,,,,,,,,,,,,,,,,,,,,,,,,,1614-04161-0000-00001-0000-,,155500,3,1.10,1,1,"Upper Vailsburg",,66.1X100,2,2,1930,"1 Unit, Radiators - Steam","Ceiling Fan, Window A/C(s)",No,,"Enclosed Porch(es)",Colonial,13x11,12x11,11x8,,12x11,24x11,,Yes,15x11,7,1,"Asphalt Shingle",Wood,,0.15,*,,,"Dryer, Range/Oven-Gas, Refrigerator, Washer",123900,*,31600,*,,*,,"Full, Slab, Unfinished",,Second,Second,Second,,4161,*,,,,,No,,,,,,16,*,*,,,Yes,"2 Car Width, Concrete, Driveway-Exclusive, Fencing, Off-Street Parking",,No,,,,,,"Living Room, See Remarks, Wood Burning",Wood,"Detached Garage, Garage Door Opener, Garage Parking",,Gas-Natural,15,"2024-03-04 23:21:18.0",5273340,40.74088,,,,"COLDWELL BANKER REALTY RDG",201-445-9400,,-74.23985,Corner,1,*,*,,,,,,,,,"Fee Simple",,,,30-60,Yellow,"Nestled in the serene Upper Vailsburg section of Newark, NJ, this meticulously maintained single-family home exudes timeless charm and modern elegance. As you step inside, you're greeted by the warm glow of refinished original hardwood floors throughout which leads to an open living space, crowned with incredible original molding and windows adorned with original casings and sills throughout. A sun-lit den creates a zen space for an office or reading nook. Adjacent, the formal dining room provides opportunities for intimate gatherings with an entryway into the updated kitchen. Equipped with stainless steel appliances, granite countertops, and an original built-in cabinet with plenty of natural light, offering a retreat to the enclosed porch. Upstairs, 3 large bedrooms promise restful nights, alongside a large, renovated full bathroom. A vast walk-up attic offers endless potential to become another cherished living space.The home also features an unfinished basement with a half bathroom and external side entry, ready to be transformed into a vibrant family room or recreational area. The detached garage, accommodating up to 4 cars, underscores the property's blend of charm and functionality. Freshly painted and lovingly maintained, this home stands as a testament to quality and care. Step into this enchanting abode and feel the embrace of a home that offers not just living spaces, but a canvas for your family's future memories.",,,,"Laundry Room, Outside Entrance, Toilet, Utility Room",13x10,First,"Formal Dining Room",First,First,,"Separate Dining Area",First,First,"Den,DiningRm,Vestibul,FamilyRm,Foyer,Kitchen,LivingRm,Screened","3 Bedrooms, Bath Main",Attic,,,Bathroom,Second,Attic,Third,Toilet,Basement,"Screened Patio/Porch",First,,"Cable TV Available, Fiber Optic Available","Public Sewer",,,,*,140,*,Colonial,,,5797,*,*,3.728,*,2023,2023,*,1614,*,*,Gas-Natural,No,"Public Water",Gas,,Approximate,*,,"Single Family",Y,,"See Remarks",,,,No,,"2024-03-04 23:06:01.934","Coming Soon","2024-03-04 23:06:02.0",Y,A,2024-03-10,Y,Y,201-949-8229
3,"Boyd Blvd",,"Hillsborough Twp.",08844-7009,,,,,,267673,,,,,,,6006,,2024-03-05,519000,,,,,"Coming Soon",,,Somerset,"Rt 206 to Falcon Rd, Left on Sunnymead to Weston Rd, Left on Boyd Blvd. #3. Second house on the right.","2024-03-05 08:10:40.0",3889060,Residential,,,,,,,,,,,,,,,,,,,,,,,,2710-00140-0002-00084-0000-,,364000,3,2.20,2,2,"Hearthstone of Hillsborough",333,0.061,1,1,2007,"1 Unit, Forced Hot Air","1 Unit, Ceiling Fan, Central Air",Yes,"Blinds,CODetect,CeilCath,FireExtg,CeilHigh,SmokeDet,StallShw,WlkInCls","Patio, Thermal Windows/Doors","Multi Floor Unit, Townhouse-Interior",14x14,10x18,10x14,,14x12,14x17,45x13,Yes,10x13,8,0,"Asphalt Shingle","Stone, Vertical Siding",,0.06,*,,1665,"Carbon Monoxide Detector, Cooktop - Electric, Dishwasher, Disposal, Dryer, Microwave Oven, Range/Oven-Electric, Refrigerator, Sump Pump, Washer",224000,*,140000,*,,*,Monthly,"Finished, Full","Stall Shower",First,Second,Second,,140.02,*,,,,,Yes,,,,"Billiards Room, Club House, Exercise Room, Kitchen Facilities, Pool-Outdoor, Tennis Courts",,27,*,*,,,Yes,"1 Car Width, Blacktop, On-Street Parking",,Unknown,"Personal Property",,"Maintenance-Common Area, Snow Removal, Trash Collection",,"One Time",,"Carpeting, Tile, Wood","Attached,DoorOpnr,InEntrnc",,Gas-Natural,21,"2024-03-05 08:12:56.0",5272736,40.52636,,,,"KELLER WILLIAMS GREATER BRUNSWICK",908-751-7721,,-74.60431,"Wooded Lot",84,*,*,10x11,19x23,,,,,,,"Fee Simple",Yes,,"Association Pool",Closing,,"Welcome home to this beautiful 55+ Active Adult Community! Hearthstone of Hillsborough is amazing! Entering the Townhome you will notice the open floor plan flooded with natural light. The gleaming wood floors in the living room, and dining room are lovely. In the kitchen you have a seperate dining area with a picture window room accent. The living room/dining room combination, is the perfect place to entertain. The first floor master bedroom is complete with a walk in closet and full bath. The laundry room is on the first floor for added convenience. The second floor wlelcomes you into a loft. The loft has a birds eye view of the first floor. The loft is surrounded by two bedrooms, a full bath, and a walk in storage closet. It gets better. The basement is finished with a great room and atrium doors leading to a full office. The half bath and utility room completes the basement. The wooded back yard makes this home a must see!!!",08844,,,"Bath(s) Other, Family Room, Office, Storage Room, Utility Room",,,"Living/Dining Combo",First,Basement,,"Galley Type, Pantry, Separate Dining Area",First,First,"1Bedroom,BathMain,Breakfst,Foyer,GarEnter,Kitchen,Laundry,LivDinRm,Pantry,PowderRm","2 Bedrooms, Bath(s) Other, Loft, Storage Room",Attic,,"1st Floor, Full Bath, Walk-In Closet",Breakfast,First,Loft,Second,,,,,,"Cable TV Available, Garbage Included","Public Sewer, Sewer Charge Extra",,,2016,*,3,*,"Multi Floor Unit",,,7836,*,*,2.153,*,2023,2023,*,2710,*,*,"Electric, Gas-Natural",,"Public Water, Water Charge Extra",Gas,,Approximate,*,,Condo/Coop/Townhouse,Y,,"See Remarks",,,,Yes,,"2024-03-05 05:41:12.237","Coming Soon","2024-03-05 05:41:12.0",Y,A,2024-03-10,Y,Y,908-751-7721
235,"S 7Th St",,"Newark City",07103-2412,,,,,,395032,,,,,,,5028,,2024-03-05,350000,,,,,Active,,,Essex,"Take 129 onto I-95. Take exit 13 to I-278 E. Take exit toward US-1, keep right onto bayway ave. Turn left onto 3rd ave. Turn right onto S 7th St.","2024-03-05 06:40:33.0",3889062,SFH,,,,,,,,,,,,,,,,,,,,,,,,1614-01780-0000-00020-0000-,,145000,5,1.20,1,2,,,25X100,0,,1891,"Radiators - Hot Water",None,,,,"Fixer Upper",,,,,,,,Yes,,10,0,"Asphalt Shingle",Wood,,0.06,*,,,"See Remarks",118700,*,26300,*,,*,,Unfinished,,,,,,1780,*,,,,,No,,,,,,16,*,*,,,No,"On-Street Parking",,No,"Personal Belongings",,,,,,"Carpeting, Wood","On-Street Parking",,Gas-Natural,28,"2024-03-05 06:28:27.0",5269699,40.7409,,,,"EXP REALTY, LLC",866-201-6210,,-74.19744,,20,*,*,,,,,,,,,"Fee Simple",,,,"at closing",,"Investor Special in the Heart of Newark - Excellent Potential for Multi-Family ConversionWelcome to an incredible investment opportunity in the vibrant heart of Newark! This spacious 5-bedroom, 1 full bath, and two half-bath home spans 2,200 square feet, boasting great bones and high ceilings, offering a perfect canvas for your vision.Key Features:5 Bedrooms, 1 Full Bath, 2 Half Baths2,200 Square FeetGreat Bones and High CeilingsPotential for Multi-Family ConversionPrime Location: Situated strategically, this property is close to parks, schools, shopping centers, and convenient transportation options. Whether you're looking to tap into the rental market or transform this space into a multi-family dwelling, the possibilities are endless.Investor-Friendly Details:After Repair Value (ARV): $450,000 - $475,000Ideal for Investors Seeking High ROI or First Time Home Buyers Looking for Low Entry and Light to Medium Rehab.Proximity to Schools, Parks, and ShoppingExcellent Transportation AccessibilityThis property presents a unique opportunity for those with a keen eye for value and potential. With the prospect of a multi-family conversion and a desirable location, don't miss out on this chance to turn this house into a lucrative investment.Schedule a viewing today and unlock the full potential of this Newark gem!",,,,,,,,,,,"See Remarks",,,"Bath(s) Other, Dining Room, Kitchen, Living Room",,,"Additional Bathroom",,,,,,,,,,,,"Public Sewer",,,2200,*,235,*,"Fixer Upper",,,5417,*,*,3.736,*,2022,2022,*,1614,*,*,"Electric, Gas-Natural",,"Public Water","See Remarks",,Approximate,*,,"Single Family",Y,,"See Remarks",,,,No,,"2024-03-05 06:03:57.452",Active,"2024-03-05 06:03:57.0",Y,A,,N,N,908-489-2740
59,"Briar Hills Cir",,"Springfield Twp.",07081-3419,,,,,,303483,,,,,,,000604,,2024-03-05,700000,,,,,Active,,,Union,"Wentz Ave to Briar Hills Circle","2024-03-06 07:19:54.0",3889063,,,,,,,,,,,,,,,,,,,,,,,,,2917-03502-0000-00015-0000-,,528500,4,2.10,2,1,,,0.231AC,1,,1956,"1 Unit","1 Unit",No,"CeilCath,FireExtg,Skylight,SmokeDet,StallShw","Patio, Sidewalk","Custom Home",14x13,12x9,11x9,12x11,13x11,19x20,29x14,Yes,12x9,8,2,"Asphalt Shingle",Wood,,0.23,*,,,"Carbon Monoxide Detector, Dishwasher, Dryer, Microwave Oven, Range/Oven-Electric, Refrigerator, Washer",298500,*,230000,*,No,*,,Unfinished,"Stall Shower",Second,Second,Second,Ground,3502,*,,,,,No,,,,,,29,*,*,,,No,"2 Car Width, Blacktop",,Unknown,"Dining room Chandelier",,,,,"Family Room, Living Room, Wood Burning","Tile, Wood","Attached Garage",,Gas-Natural,31,"2024-03-05 08:13:17.0",5271656,40.6889,,,,"WEICHERT REALTORS",973-539-8000,,-74.33978,,15,*,*,30x20,,,,,,,,"Fee Simple",,,,"upon closing",,"The cutest neighborhood that only people who live there drive through! Springfield is close to Summit and many other towns with a direct train line to NYC. LOW TAXES! Only one owner, lovingly maintained! Come and visit this BRIGHT and open floor plan. Huge ceilings in the main room as you enter with 3 skylights. Enjoy a relaxing day with a corner fireplace. New windows on the front of the home in the living and dining room. Hardwood floors are pristine. Furnace, hot water heater and central air replaced 2017. This is an estate. Spacious eat in kitchen clean and ready for you! Downstairs is the den with another fireplace and walk-out to the backyard. This walk out level also has the 4th bedroom/office and half bathroom. Outside is a partially fenced in yard with lots of possibilities! On the 2nd floor there is a Primary suite with 2 closets and a full bathroom. 2 more bright bedrooms are down the hall and share a full pink bathroom. There is a neighborhood playground and baseball field a short distance from the home. This home has been lovingly maintained by the same owner for many years.",,,,"Laundry Room, Storage Room, Utility Room",,,"Formal Dining Room",First,Ground,"1Bedroom,BathOthr,FamilyRm,GarEnter","Eat-In Kitchen",First,First,"Dining Room, Kitchen, Living Room","3 Bedrooms, Bath Main, Bath(s) Other",,,"Full Bath","Laundry Room",Basement,,,,,,,,,"Public Sewer",,,,*,59,*,"Custom Home",Yes,"Bedroom1,Den,HalfBath,SepEnter",12345,*,*,2.336,*,2023,2023,*,2917,*,*,Gas-Natural,No,"Public Water",Gas,,Approximate,*,,"Single Family",Y,,"See Remarks",,,,No,,"2024-03-05 06:47:39.91",Active,"2024-03-05 06:47:39.0",Y,A,,N,N,917-453-7335
9,"Chambers Pl",,"Randolph Twp.",07869-2950,,,,,,211142,,,,,,302430,550207,,2024-03-05,850000,,,,,"Coming Soon",,,Morris,"Rt. 10 to Dover Chester Rd. South, L. on Morris Tpke., R. on Chambers","2024-03-06 16:51:48.0",3889066,Res,,,,,,,,,,,,,,,,,,,,,Ironia,Randolph,Randolph,2332-00046-0000-00030-0000-,,688800,4,3.10,3,1,Ironia,,"1.34 AC",3,,1988,"2 Units, Forced Hot Air","2 Units, Ceiling Fan, Central Air",No,"Beam Ceilings, Cathedral Ceiling, Fire Alarm Sys, Fire Extinguisher, Intercom, Security System, Skylight, Smoke Detector","Deck, Hot Tub",Colonial,21x14,15x13,15x14,13x12,18x13,18x14,33x22,Yes,19x15,9,1,"Asphalt Shingle","Brick, Vinyl Siding",,1.34,*,,,"Carbon Monoxide Detector, Central Vacuum, Cooktop - Gas, Dishwasher, Dryer, Microwave Oven, Refrigerator, Trash Compactor, Wall Oven(s) - Electric, Washer",457600,*,231200,*,No,*,,"Finished, Full, Walkout","Jetted Tub, Stall Shower",Second,Second,Second,Second,46,*,,,,,No,,,,,,23,*,*,,,Yes,Blacktop,,Unknown,"Dining Room Chandelier. Note - basement fridge included.",,,,,"Family Room","Tile, Vinyl-Linoleum, Wood","Built-In Garage, See Remarks",No,Gas-Natural,32,"2024-03-05 08:46:11.0",5259239,40.84299,,,,"COMPASS NEW JERSEY, LLC",973-315-8180,,-74.60263,"Level Lot",30,*,*,15x11,,,,,,,,"Fee Simple",,,,P.O.T.,,"Don't miss this large 4-bedroom, 3.5 bathroom brick front colonial nestled in a peaceful neighborhood at the end of a cul-de-sac. The renovated center-island kitchen boasts stainless steel appliances, granite countertops, and a spacious eat-in area that opens to a stunning 2-story great room with a soaring 20ft+ cathedral ceiling, fireplace, and a large overlooking balcony from the master suite. The 1st level offers a formal living room with French doors, a large formal dining room, a full bathroom, a first-floor office/guest room, and a convenient laundry room. The master suite features an en-suite bath with a stall shower and soaking tub, a walk-in closet, and a balcony overlooking the great room. The 2nd level is complete with 3 additional bedrooms and an updated main bathroom. The finished walkout basement includes a rec room, exercise room, powder room, mudroom area, and access to a 3-car garage. The exterior of this home features a beautiful, expansive, covered deck with hot tub and is set on a 1.34 acre lot with a level backyard area. Additional features include hardwood floors throughout, multi-zone heating and air conditioning, public water, natural gas, and much more!  An already exceptional value with potential added value with your own cosmetic and additional bathroom updates.",07869,,,"Exercise Room, Powder Room, Rec Room, Utility Room, Walkout",,,"Formal Dining Room",First,First,,"Breakfast Bar, Center Island, Eat-In Kitchen, Pantry",First,First,"1Bedroom,BathOthr,DiningRm,FamilyRm,Foyer,GarEnter,Kitchen,Laundry,LivingRm,Pantry","4 Or More Bedrooms, Bath Main, Bath(s) Other",Attic,,"Full Bath, Walk-In Closet",Bedroom/Office,First,,,,,,,,"Cable TV Available, Garbage Included",Septic,,,3786,*,9,*,Colonial,,,19010,*,*,2.760,*,2023,2023,*,2332,*,*,"All Underground, Electric, Gas-Natural",No,"Public Water",Gas,,Approximate,*,,"Single Family",Y,,"See Remarks",,,,No,,"2024-03-05 07:46:10.368","Coming Soon","2024-03-05 07:46:10.0",Y,A,2024-03-10,Y,Y,973-769-1563
4,"Lake Shore Rd",,"Hardyston Twp.",07460-1209,,,,,,264179,,,,,,,0359,,2024-03-05,349900,,,,,"Coming Soon",,,Sussex,"Route 23 to Lake Shore Rd E (GPS 3 Ridgeview Ct Lk Tamarack)","2024-03-05 15:36:36.0",3889068,Res,,,,,,,,,,,,,,,,,,,,,,,,2811-00084-0000-00011-0002-,,214400,3,1.10,1,1,"Lake Tamarack",560,".341 AC",2,,1960,"1 Unit, Forced Hot Air","1 Unit, Central Air",,"CeilBeam,Blinds,CeilCath,StallShw,TubShowr","Deck, Open Porch(es), Storage Shed","Ranch, Expanded Ranch",,,,,,,,Yes,,7,0,"Asphalt Shingle","Vinyl Siding",,0.34,*,,1000,"Microwave Oven, Range/Oven-Electric, Refrigerator",117300,*,97100,*,,*,Annually,"Unfinished, Walkout",,First,First,First,,84,*,,,,,Yes,,,,"ClubHous,LakePriv,MulSport,Playgrnd",,28,*,*,,,No,Blacktop,,Unknown,,,"Water Fees",600,"One Time",,"Carpeting, Vinyl-Linoleum","Built-In Garage",,OilAbIn,29,"2024-03-05 08:46:11.0",5273349,41.098353790120484,,,,"C-21 CREST REAL ESTATE, INC.",973-686-1500,,-74.53354597091676,"Lake/Water View",11.02,*,*,,,,,,,,,"Fee Simple",Yes,,,30-60,,"Wonderful Lake Tamarack with endless beauty. Expanded 3 bedroom ranch with family room addition over 2 car garage, situated on double lot, .34 acres. One level living. Large basement. Central air. Master bedroom with powder room. Living room open to dining room offering lots of space. Dining room open to kitchen with access to deck with seasonal lake views. Enjoy two beaches, playground, picnic area, sports court, swim team, fishing and more. Membership required. Convenient location-minutes to route 23.",07460,,,"GarEnter,RecRoom,Storage,Utility,Walkout",,,"Formal Dining Room",First,First,,"Not Eat-In Kitchen, Pantry",First,First,"3 Bedrooms, Bath Main, Dining Room, Family Room, Kitchen, Living Room, Powder Room",Attic,,,"1st Floor, Half Bath","Rec Room",Basement,"Storage Room",Basement,"Utility Room",Basement,"Laundry Room",Basement,,"Cable TV",Septic,,,1564,*,4,*,Ranch,,,6528,*,*,3.045,*,2023,2023,*,2811,*,*,"See Remarks",,"Association, Water Charge Extra",Electric,,Approximate,*,,"Single Family",Y,,"See Remarks",,,,No,,"2024-03-05 08:02:33.486","Coming Soon","2024-03-05 08:02:33.0",Y,A,2024-03-09,N,N,973-686-1500
27,"Dodd St",,"Montclair Twp.",07042-5019,,,,,,288082,,,,,,,5502,,2024-03-05,719000,,,,,"Coming Soon",,,Essex,"Ridgewood to Dodd","2024-03-06 18:31:01.0",3889069,,,,,,,,,,,,,,,,,,,,,,MAGNET,MAGNET,MONTCLAIR,1613-04404-0000-00005-0000-,,539700,4,1.20,1,2,,,40X150,2,2,1924,"1 Unit, Radiators - Steam","Window A/C(s)",No,"Carbon Monoxide Detector, Fire Extinguisher, Smoke Detector","Curbs, Sidewalk, Wood Fence",Colonial,15x11,12x12,15x11,24x11,12x11,18x11,,Yes,11x9,8,0,"Asphalt Shingle",Clapboard,,0.14,*,,,"Carbon Monoxide Detector, Dishwasher, Dryer, Microwave Oven, Range/Oven-Gas, Refrigerator, Washer",209700,*,330000,*,No,*,,Finished-Partially,,Second,Second,Second,Third,4404,*,,,,,No,,,,,,16,*,*,,,Yes,"2 Car Width",,Unknown,,,,,,,"Tile, Wood","Detached Garage",No,Gas-Natural,20,"2024-03-05 20:04:01.0",5271569,40.82356,,,,"COMPASS NEW JERSEY, LLC",973-310-6816,,-74.19926,"Level Lot",5,*,*,24x6,,,22x21,,,,,"Fee Simple",Yes,,,"At closing",Gray,"Welcome to 27 Dodd Street. This lovingly cared for colonial features 4 bedrooms, and a spacious living area perfect for entertaining guests or relaxing with family. The deep backyard offers a peaceful retreat, while the inviting front porch provides the perfect spot to enjoy your morning coffee. As you step inside, you'll be greeted by an abundance of natural light and hardwood floors throughout. The entryway opens to the living room and flows into the dining room - ideal for hosting dinner parties or casual family meals. Located off the dining room is the eat-in kitchen, with a window view of the backyard. A powder room completes the first floor. The second floor has three bedrooms and the main bath with plenty of space to provide flexibility for home office needs. The fourth bedroom is located on the 3rd floor. The partially finished basement provides extra living space, perfect for a playroom or home gym and has an additional bathroom with a shower stall. Conveniently located near top-rated schools, NYC transportation, local parks, and shopping, this home offers the perfect blend of suburban tranquility and urban convenience. With its ideal location and charming features, 27 Dodd Street is ready to welcome you home.",,,,"BathOthr,Laundry,RecRoom,SeeRem,Storage",,,"Formal Dining Room",First,,,"Eat-In Kitchen",First,First,"Dining Room, Kitchen, Living Room, Porch, Powder Room","3 Bedrooms, Bath Main","1 Bedroom",,,Porch,First,,,,,"See Remarks",Basement,,"Cable TV Available","Public Sewer",,,,*,27,*,Colonial,No,,18241,*,*,3.380,*,2023,2023,*,1613,*,*,"All Underground, Electric, Gas-Natural",No,"Public Water",Gas,,Approximate,*,,"Single Family",Y,,"See Remarks",,,,No,,"2024-03-05 08:09:31.429","Coming Soon","2024-03-05 08:09:31.0",Y,A,2024-03-07,Y,Y,973-382-5386
36,"Dartmoor Rd",,"East Hanover Twp.",07936-3912,,,,,,274617,,,,,,,002410,,2024-03-05,765000,,,,,"Coming Soon",,,Morris,"River Rd to Fox Run to Dartmoor","2024-03-05 08:33:13.0",3889070,,,,,,,,,,,,,,,,,,,,,,Franksmith,"East Hanov","Hanover PK",2310-00039-0006-00009-0000-,,411600,4,2.10,2,1,"Fox Run",,100X200,2,6,1985,"1 Unit, Baseboard - Hotwater","1 Unit, Ceiling Fan, Central Air",No,"CODetect,FireExtg,SmokeDet,StallShw,StallTub,WlkInCls","Deck, Storm Window(s)",Colonial,13x19,13x11,12x13,13x14,11x12,19x13,13x18,Yes,18x11,11,1,"Asphalt Shingle","Brick, Vinyl Siding",,0.46,*,,,"Carbon Monoxide Detector, Dishwasher, Dryer, Range/Oven-Gas, Refrigerator, Sump Pump",254800,*,156800,*,,*,,"Full, Unfinished","Stall Shower",Second,Second,Second,Second,39.06,*,,,,,No,,,,,,23,*,*,,,Yes,"2 Car Width, Blacktop",,Unknown,,,,,,"Family Room, Wood Burning","Laminate, Wood","Built-In Garage",No,Gas-Natural,21,"2024-03-05 08:26:33.0",5273309,40.81931,,,,"COLDWELL BANKER REALTY",973-377-4444,,-74.33845,"Level Lot",9,*,*,8x12,11x12,,,,,,,"Fee Simple",,,,closing,,"Welcome to your new home nestled in a charming, well-established neighborhood! This light and bright 4 bdr, 2.5 bath house offers abundant space and potential, inviting you to personalize it to your taste. Enjoy an open floor plan with hardwood floors on first and second floors and ample room for living and entertaining. The first floor features three living areas, a formal dining room, an eat-in kitchen, a laundry room, a half bath and a bonus room. Upstairs you'll find four well-appointed bedrooms including a huge master suite with two closets and a spacious bathroom. A large unfinished basement is perfect for storage or ready to be transformed into your dream space. Roof and utilities recently updated and brand new 200 amp service! Situated on a large property that backs to serene woods, enjoy the tranquility and privacy of nature right in your backyard. East Hanover offers top-notch schools and commuter options to NYC.",,,,,12x12,First,"Formal Dining Room",First,First,,"Eat-In Kitchen",First,First,"Den,DiningRm,FamilyRm,Foyer,GarEnter,Kitchen,Laundry,LivingRm,Office,PowderRm","4 Or More Bedrooms, Bath Main, Bath(s) Other",,,"Full Bath, Walk-In Closet","Laundry Room",First,Office,First,,,,,,"Cable TV Available, Fiber Optic Available, Garbage Extra Charge","Public Sewer",,,,*,36,*,Colonial,No,,10269,*,*,2.495,*,2023,2023,*,2310,*,*,"Electric, Gas-Natural",,"Public Water",Gas,,Approximate,*,,"Single Family",Y,,"See Remarks",,,,No,,"2024-03-05 08:13:25.631","Coming Soon","2024-03-05 08:13:26.0",Y,A,2024-03-08,Y,Y,973-945-6865
7,"Amethyst Ln",7,"Paterson City",07501-3364,,,,,,250086,,,,,,,1973,,2024-03-05,329000,,,,,Active,,,Passaic,"Rifflecamp Road to Boulder to Amethyst","2024-03-06 18:27:01.0",3889071,,,,,,,,,,,,,,,,,,,,,,,,,2508-05103-0000-00023-0000-C221,,215400,2,2.00,2,0,"Garrett Heights",410,0.00,0,0,1988,"1 Unit, Forced Hot Air, See Remarks","1 Unit, Central Air",No,"Blinds,CODetect,FireExtg,Intercom,JacuzTyp,SmokeDet,StallTub,TubShowr","Deck, Storm Window(s)","One Floor Unit",,,,,,,,No,,5,1,"Asphalt Shingle","Vinyl Siding",,0.00,*,,410,"Carbon Monoxide Detector, Dishwasher, Dryer, Microwave Oven, Range/Oven-Gas, Refrigerator, Washer",121200,*,94200,*,No,*,Monthly,,"Jetted Tub, Stall Shower And Tub",First,First,,,5103,*,,,,,Yes,,,,,,25,*,*,,,Yes,"Blacktop, Common",,Unknown,"Seller's personal possessions.",,"Maintenance-Common Area, Maintenance-Exterior",350,R,"Living Room, Wood Burning",Wood,None,No,Gas-Natural,18,"2024-03-05 11:28:33.0",5273350,40.90534,,,,"VALLEY REALTY",201-796-5263,,-74.18337,"Mountain View",23,*,,,,,,,,,,Condominium,"Cats OK, Dogs OK",,,Flexible,Gray,"This 2 bedroom/2 bathroom condo is one of a kind with custom wood trim, moldings and hardwood flooring throughout the entire unit. Newly installed recessed lighting with dimmer switch option. Projection television installed. Located on the second floor on the last street of the complex allowing unobstructed views of the mountains and surrounding areas from the Unit or deck. The main bedroom bathroom has private bathroom with jet tub. Large closet with organizers. Bedroom 2 has a wall to ceiling bookcase and large closet with organizer. Kitchen upgraded with new tiling and appliances. Large counter space which opens up to dining area. Wood burning fireplace. Laundry in unit.",07501,,2017,SeeRem,,,"Dining L",First,,SeeRem,"Not Eat-In Kitchen",First,First,"2Bedroom,BathMain,BathOthr,DiningRm,Foyer,InsdEntr,Laundry,LivingRm",,,,"1st Floor, Full Bath","Laundry Room",First,Bathroom,First,Bathroom,First,,,,"Cable TV Available, Garbage Included","Public Sewer",,,,*,7,*,"One Floor Unit",No,,10561,*,*,4.903,*,2023,2023,*,2508,*,*,"Electric, Gas-Natural",No,"Public Water",Gas,,Approximate,*,,Condo/Coop/Townhouse,Y,,"See Remarks",,,,No,2,"2024-03-05 08:20:28.958",Active,"2024-03-05 08:20:29.0",Y,A,,N,N,201-796-5263
