24,"Hilltop Cir",,"Morris Twp.",07960-6328,,,,,,211294,,,,,,,009905,,2024-03-01,1499000,,,,,"Coming Soon",,,Morris,"James Street to Armstrong to Hilltop Circle","2024-03-04 15:30:33.0",3888529,Res,,,,,,,,,,,,,,,,,,,,,Hillcrest,Frelghuysn,Morristown,2322-06404-0000-00016-0000-,,1035200,5,4.10,4,1,"Spring Brook",,".544 AC",2,,1977,"Forced Hot Air, Radiant - Electric","Ceiling Fan, Central Air",No,"BarWet,Blinds,CODetect,CedrClst,AlrmFire,SecurSys,SmokeDet,SoakTub,StallShw,StallTub,TubShowr,WlkInCls","Curbs, Deck, Patio, Storage Shed, Underground Lawn Sprinkler",Colonial,14x19,12x13,13x13,13x15,14x15,21x14,22x15,Yes,10x13,22,2,"Asphalt Shingle",Stucco,,0.54,*,,,"Carbon Monoxide Detector, Dishwasher, Dryer, Instant Hot Water, Kitchen Exhaust Fan, Microwave Oven, Range/Oven-Gas, Refrigerator, Self Cleaning Oven, Washer, Wine Refrigerator",658000,*,377200,*,No,*,,"Finished, Full, Walkout","Soaking Tub, Stall Shower",Second,Second,Second,Second,6404,*,,,,,No,,,,Storage,,23,*,*,,,Yes,"1 Car Width, Additional Parking, Blacktop, Circular, Off-Street Parking","Power lines",Yes,"Ask listing agents for exclusions and inclusions",,,,,"Family Room, Living Room","Marble, Tile, Wood","Attached Garage, Garage Door Opener",No,Gas-Natural,34,"2024-03-01 12:34:53.0",5271985,40.77407436830631,,,,"TURPIN REAL ESTATE, INC.",973-635-5555,,-74.48076009750368,Cul-De-Sac,16,*,*,13x24,9x14,,7x13,,,,,"Fee Simple",,,,POT,White,"Nestled in a sought after picturesque setting at the end of a cul-de-cac, this residence boast designer features and upscale amenities.This stately Colonial Revival home offers five bedrooms and four full baths. Upon entering the grand foyer, guests are greeted by timeless beauty of the LR complemented by the warmth of a Fpl, DR, fine mill work. French doors lead from LR to Sunroom. EIK w separate breakfast area and walk-in pantry. FR with Fpl and access to deck. Laundry/mud Rm, powder Rm, 2 deck areas add to complete first level. Sun light abounds through out! Second Fl boast four bedroom, 2 full baths, primary suite offers large walk-in closet/dressing area, primary bath offers 2 custom vanities, soaking tub and stall shower. The fully finished lower level offers Rec Rm, partial Kit with Ref and sink, an in-law suite with full bath and and large workshop. French door in Rec Rm leads to large patio with Fire pit. On the side of the house is a finished, electrified shed. Too many amenities to list. Not to be missed!",,,2014,"1 Bedroom, Bath(s) Other, Kitchen, Rec Room, Walkout, Workshop",,,"Formal Dining Room",First,First,,"Center Island, Eat-In Kitchen, Pantry, Second Kitchen",First,First,"Breakfst,DiningRm,FamilyRm,Foyer,Kitchen,Laundry,LivingRm,MudRoom,OutEntrn,Pantry,PowderRm,Sunroom","4 Or More Bedrooms, Bath Main, Bath(s) Other",Attic,,"Dressing Room, Walk-In Closet",Sunroom,First,Breakfast,First,PowderRm,First,"Laundry Room",First,,"Cable TV Available, Garbage Extra Charge","Public Sewer",,,3632,*,24,*,Colonial,Yes,"Bedroom 1, Full Bath",20755,*,*,2.005,*,2023,2023,*,2324,*,*,"Electric, Gas-Natural",No,"Public Water",Gas,,Renovated,*,,"Single Family",Y,,"See Remarks",,,,No,,"2024-03-01 10:57:41.115","Coming Soon","2024-03-01 10:57:41.0",Y,A,2024-03-08,N,N,info@turpinrealtors.com
649,"Belvidere Rd",,"Lopatcong Twp.",08865-1361,,,,,,287282,,,,,,,002463,,2024-03-01,415000,,,,,Active,,,Warren,"Route 22 to Lincoln. Right on Belvidere to #649 on left.","2024-03-05 19:27:35.0",3888535,,,,,,,,,,,,,,,,,,,,,,,,,3015-00024-0000-00015-0000-,,168300,3,1.10,1,1,"Delaware Heights",,.27,0,3,1887,"No Heat, See Remarks, Space Heater","Ceiling Fan",No,"Carbon Monoxide Detector, Cedar Closets, Fire Extinguisher, Smoke Detector",Patio,Colonial,16x12,13x12,9x15,,13x13,12x15,15x10,Yes,15x13,8,1,"Asphalt Shingle","Aluminum Siding",,0.27,*,,,"Carbon Monoxide Detector, Dishwasher, Dryer, Range/Oven-Gas, Refrigerator, Washer",80200,*,88100,*,No,*,,Unfinished,,Second,Second,Second,,24,*,,,,,No,,,,,,30,*,*,,,Yes,"Crushed Stone, Off-Street Parking, On-Street Parking",,No,"Free-standing shed in yard.",,,,,"See Remarks","Carpeting, Vinyl-Linoleum, Wood",,No,Gas-Natural,17,"2024-03-01 12:33:22.0",5271375,40.70161,,,,"COLDWELL BANKER REALTY",908-735-8080,,-75.189,,15,*,*,11x15,,,,,,,,"Fee Simple",Yes,,,POT,,"Wonderful vintage colonial home located in desirable Delaware Heights.  Home features great character, three-bedrooms ,1.5 baths, thoughtful modern kitchen, flexible living areas, generous bedrooms, walk-up attic, first floor laundry, stainless steel package. lovely hardwood floors and a host of other features. The property further offers a huge yard with koi pond, mature fruit trees, flower gardens and as a bonus, a direct rear-alley entrance with pad parking (waiting for garage ideas).  Property also features public water and sewer...wow...great value-great new price!!",,,2005,,,,"Formal Dining Room",First,First,,"Center Island, Eat-In Kitchen",First,First,"DiningRm,FamilyRm,Kitchen,Laundry,LivingRm,Workshop","3 Bedrooms, Bath Main",Attic,,"Dressing Room","Laundry Room",First,,,,,,,,"Cable TV Available, Garbage Extra Charge","Public Sewer",,,,*,649,*,Colonial,No,,4811,*,*,2.859,*,2023,2023,*,3015,*,*,"Electric, Gas-Natural",No,"Public Water",,,Approximate,*,,"Single Family",Y,,"See Remarks",,,,No,,"2024-03-01 11:10:36.663",Active,"2024-03-01 11:10:37.0",Y,A,,Y,Y,908-391-7321
4,"Poplar Pl",,"Fairfield Twp.",07004-3210,,,,,,293608,,,,,,280315,061801,,2024-03-01,449888,,,,,Active,,,Essex,"Fairfield Rd to Laurel Pl to Poplar Pl","2024-03-06 15:26:53.0",3888538,,,,,,,,,,,,,,,,,,,,,,STEVENSON,"W ESSEX","W ESSEX",1607-00902-0000-00002-0000-,,354100,3,2.00,2,0,,,100X169,2,4,1963,"Baseboard - Hotwater",None,Yes,"Blinds, Carbon Monoxide Detector, Fire Extinguisher, Smoke Detector","Curbs, Patio, Storage Shed",Bi-Level,,,,,,,,No,,8,0,"Asphalt Shingle","Aluminum Siding, Brick",,0.39,*,,,"Carbon Monoxide Detector, Dishwasher, Dryer, Range/Oven-Gas, Washer",129700,*,224400,*,No,*,,,,First,First,First,,902,*,,,,,No,,,,,,16,*,*,,,No,Blacktop,,Unknown,,,,,,,"Tile, Wood","Attached Garage",No,Gas-Natural,22,"2024-03-01 11:40:30.0",5272002,40.86902,,,,"LATTIMER REALTY",973-226-1717,,-74.3031,,2,*,*,,,,,,,,,"Fee Simple",Yes,,"Above Ground",Flexible,,"Explore this incredible deal and your chance to craft the perfect haven! Step into this spacious bi-level in the heart of Fairfield. Set on a sprawling lot with an aboveground pool and abundant space for expansion or customization. Inside, discover an open-concept layout, blending living and dining areas seamlessly with a well-appointed kitchen. Surrounded by windows with stunning views of the backyard, perfect for relaxation. Retreat to the spacious primary bedroom with double closets. Two more bedrooms and a hallway bath complete the main level. Below, a cozy family room, alongside a second kitchen and sliders leading you to the patio. A laundry room, full bath, and two-car garage round out this level. With its prime location and undeniable charm, this home won't last!",,,,,,,"Dining L",First,First,"BathOthr,FamilyRm,GarEnter,Kitchen,Laundry","Eat-In Kitchen",First,First,"3 Bedrooms, Bath Main, Dining Room, Living Room",,,,,Bathroom,First,Bathroom,,,,,,,,"Public Sewer",,,,*,4,*,Bi-Level,Yes,"Kitchen, Living Room",7269,*,*,2.053,*,2023,2023,*,1607,*,*,"Electric, Gas-Natural",No,"Public Water",Gas,,Approximate,*,,"Single Family",Y,,"See Remarks",,,,No,,"2024-03-04 03:02:14.43",Active,"2024-03-01 11:12:20.0",Y,A,2024-03-04,Y,Y,973-226-1717
4,"Hunter Ln",,"Alexandria Twp.",08848-2125,,,,,,288021,,,,,,,002463,,2024-03-01,900000,,,,,"Coming Soon",,,Hunterdon,"RT579 to Hickory Corner Road to Hunter Lane - #4 is on the right","2024-03-06 13:13:54.0",3888544,,,,,,,,,,,,,,,,,,,,,,ALEXANDRIA,ALEXANDRIA,DEL.VALLEY,1901-00007-0000-00005-0016-,,615800,5,4.10,4,1,"DEERFIELD AT ALEXANDRIA",1200,"5.339 AC",3,4,1999,"2 Units, Forced Hot Air","2 Units",Yes,"CODetect,CeilCath,FireExtg,CeilHigh,Intercom,SmokeDet,SoakTub,TubShowr,WlkInCls","Barbeque, Curbs, Deck, Metal Fence, Open Porch(es), Outbuilding(s), Patio, Storage Shed, Thermal Windows/Doors",Colonial,15x14,13x13,13x13,34x12,19x13,19x13,23x15,Yes,24x15,12,1,"Asphalt Shingle","Stone, Vinyl Siding",,5.34,*,,,"Carbon Monoxide Detector, Central Vacuum, Cooktop - Gas, Dishwasher, Kitchen Exhaust Fan, Refrigerator, Wall Oven(s) - Electric",404400,*,211400,*,No,*,Annually,"Finished, Full, Walkout","Jetted Tub, Stall Shower",Second,Second,Second,Second,7,*,,,,,Yes,,,,"Exercise Room, Pool-Outdoor, Storage",,19,*,*,,,Yes,"1 Car Width, Additional Parking, Blacktop",,Unknown,"Washer and Dryer are excluded.",,"Maintenance-Common Area, Snow Removal",,,"Wood Burning","Tile, Wood","Built-In Garage, Garage Door Opener",No,GasPropL,22,"2024-03-06 13:14:28.0",5272340,40.6126,,,,"COLDWELL BANKER REALTY",908-735-8080,,-75.0374,"Backs to Park Land, Level Lot, Wooded Lot",5.16,*,*,19x12,12x12,19x12,17x12,Home-Office,,,,"Fee Simple",Yes,,"Gunite, Heated, In-Ground Pool","At Closing",,"Nestled on a sprawling five-acre canvas of picturesque countryside, this enchanting property invites you to experience the epitome of luxurious rural living. Boasting five bedrooms and five bathrooms, this estate is a harmonious blend of expansive space and refined elegance. The residence itself is a testament to thoughtful design, offering ample space for both private retreats and grand gatherings. The five bedrooms provide comfortable sanctuaries, each uniquely designed to cater to the needs of modern living. The allure of this property extends beyond the walls, with the outdoor oasis showcasing a sparkling swimming pool that beckons for refreshing dips on warm summer days. Surrounded by the lush greenery of the countryside, the pool area becomes a private haven for relaxation and entertainment. This property represents more than just a home; it embodies a lifestyle of tranquility, sophistication, and the freedom to create your own haven in the heart of nature. If you're seeking a retreat that seamlessly blends modern comfort with the charm of country acres, this five-bedroom, five-bathroom estate on five acres with a swimming pool is an invitation to elevate your living experience to new heights.",08848,,2018,,,First,"Formal Dining Room",First,First,"Bath(s) Other, Exercise Room, Media Room, Outside Entrance, Rec Room, Storage Room, Utility Room, Walkout","Breakfast Bar, Center Island, Country Kitchen, Eat-In Kitchen, Separate Dining Area",First,First,"Breakfst,DiningRm,FamilyRm,Foyer,GarEnter,Kitchen,Laundry,LivingRm,Office,Porch,PowderRm","4 Or More Bedrooms, Bath Main, Bath(s) Other, Foyer",Attic,,"Full Bath, Walk-In Closet","Media Room",Ground,"Laundry Room",First,Office,First,"Rec Room",Ground,,"Garbage Extra Charge",Septic,,,,*,4,*,Colonial,Yes,"Bedroom1,FullBath,SepEnter",17223,*,*,2.797,*,2023,2023,*,1901,*,*,Gas-Propane,Yes,Well,Gas,,Approximate,*,,"Single Family",Y,,"See Remarks",,,,No,,"2024-03-01 11:29:33.607","Coming Soon","2024-03-01 11:29:34.0",Y,A,2024-03-10,Y,Y,908-627-3288
7,"Mohawk Dr",,"Cranford Twp.",07016-3311,,,,,,259943,,,,,,,002402,,2024-03-01,649900,,,,,"Under Contract",,,Union,"Walnut ave to Lexington to Mohawk drive or raritan road to mohawk drive.","2024-03-06 15:08:18.0",3888548,,,,,,,,,,,,,,,,,,,,,,Livston/Walnut,Hillside,"Cranford HS",2903-00626-0000-00003-0000-,,143300,3,2.00,2,0,"Indian Village",,"7187 SF",1,,1940,"1 Unit","1 Unit, Central Air",No,"CODetect,FireExtg,SmokeDet,StallShw,TubShowr,WlkInCls","Enclosed Porch(es), Patio, Storage Shed, Underground Lawn Sprinkler","Cape Cod",17x12,11x8,12x11,,,16x11,22x15,Yes,14x12,6,0,"Asphalt Shingle","Vinyl Siding",,0.17,*,,,"Carbon Monoxide Detector, Cooktop - Gas, Dishwasher, Dryer, Kitchen Exhaust Fan, Refrigerator, Wall Oven(s) - Electric, Washer, Water Filter",60600,*,82700,*,No,*,,"Finished-Partially, Full",,Second,First,First,,626,*,,,,,No,,,,Playground,,29,*,*,,,Yes,"1 Car Width, Blacktop",,Unknown,"refrigerator in basement,",,,,,,"Tile, Wood","Attached Garage",No,Gas-Natural,43,"2024-03-01 12:35:02.0",5271602,40.63984,,,,"COLDWELL BANKER REALTY",908-233-5555,,-74.29361,"Irregular Lot",3,*,*,17x10,22x19,,,,,,,"Fee Simple",,,,"May 2024",,"Imagine the opportunity to purchase a home in the desirable Indian Village section of Cranford! This 3 bedroom, 2 full bath Cape Cod style home offers an entrance vestbule that leads to the living room, expanded eat in kitchen featuring australian cypress wood floor, granite counter tops, SS appliances, picture window offers views of the back yard. Two bedrooms and updated full bath complete the 1st floor. The 2nd floor includes the primary bedroom, charming full bath w/ exposed brick! The 4th bedroom was converted to a custom walk in closet. If desired you can convert back to a bedroom and turn this 3 bed into a 4 bedroom home. For comfort and convenience this home includes central AC, a whole house generator and an aquasana water filtration system!",07016,,,"Laundry Room, Rec Room, Toilet, Utility Room",,,,,Basement,,"Eat-In Kitchen",First,First,"2 Bedrooms, Bath(s) Other, Entrance Vestibule, Kitchen, Living Room, Porch","1Bedroom,BathMain,SeeRem",,,,"See Remarks",Second,"Utility Room",Basement,,,,,,"Cable TV Available, Fiber Optic Available, Garbage Extra Charge","Public Sewer",,,,*,7,*,"Cape Cod",No,,9553,*,*,6.667,*,2023,2023,*,2903,*,*,"Electric, Gas-Natural",No,"Public Water",Gas,,Approximate,*,,"Single Family",Y,,"See Remarks",,,,No,,"2024-03-06 15:08:18.399","Under Contract","2024-03-01 11:45:08.0",Y,A,,Y,Y,908-337-2021
88,"Rockland St",,"Paterson City",07501-2561,,,,,,250376,,,,,,,5028,,2024-03-01,345000,,,,,Active,,,Passaic,"BARNES STREET TO 210 CALDWELL AVENUE -( CORNER UNIT.- AKA 88-102 ROCKLAND AVENUE- TAX RECORD)- UNIT # 7","2024-03-05 11:19:35.0",3888549,,,,,,,,,,,,,,,,,,,,,,,,,2508-04913-0000-00001-0000-C007,,118000,2,1.10,1,1,n/a,200,,1,2,1988,Multi-Zone,"Central Air",No,"Carbon Monoxide Detector, Smoke Detector",Deck,"Townhouse-End Unit, Multi Floor Unit",,,,,,,,No,,5,0,"Composition Shingle","Vinyl Siding",,0.00,*,,,"Carbon Monoxide Detector, Cooktop - Electric, Dishwasher, Microwave Oven, Range/Oven-Electric, Refrigerator",48500,*,69500,*,No,*,Monthly,,,Second,Second,,,4913,*,,,,,Yes,,,,,,25,*,*,,,Yes,"2 Car Width",,Unknown,,,"Maintenance-Exterior, Snow Removal",,,"See Remarks","See Remarks","Built-In Garage",No,"Electric, See Remarks",4,"2024-03-05 11:19:35.0",5272701,40.90817,,,,"EXP REALTY, LLC",866-201-6210,,-74.18518,Corner,1,*,*,,,,,,,,,Condominium,Yes,,,"AT CLOSING",WHITE,"MULTI- FLOOR END UNIT TOWNHOUSE-FEATURING TWO  NICE SIZE BEDROOMS AND 0NE AND A HALF BATHS,THE HEART OF THIS RESIDENCE IS THE BEAUTIFULLY UPDATED OPEN FLOOR PLAN. A SPACIOUS DECK EXTENDS FROM THE LIVING AREA, OFFERING A DELIGHTFUL OUT DOOR SPACE.THIS TOWNHOUSE IS AN IDEAL RETREAT FOR THOSE SEEKING BOTH COMFORT AND SENSE OF COMMUNITY.",,,,,,,,First,,"GarEnter,Laundry,Utility","See Remarks",First,First,"Bath(s) Other, Dining Room, Kitchen, Living Room","2 Bedrooms, Bath Main",,,,,,,,,,,,,"Cable TV","Public Sewer",,,,*,88-102,,"Townhouse-End Unit",No,,5785,*,*,4.903,*,2023,2023,*,2508,*,*,"See Remarks",No,"Public Water",Electric,,Approximate,*,,Condo/Coop/Townhouse,Y,,"See Remarks",,,,No,,"2024-03-01 11:46:38.398",Active,"2024-03-01 11:46:38.0",Y,A,,N,N,201-532-4330
201,"N Beverwyck Rd Unit 4",4,"Parsippany-Troy Hills Twp.",07034-1414,,,,,,291703,,,,,,299232,4330,,2024-03-01,210000,,,,,Active,,,Morris,"Rt 46 or Knoll rd onto N Beverwyck","2024-03-04 12:16:22.0",3888551,,,,,,,,,,,,,,,,,,,,,,Knollwood,Central,Parsippany,2329-00497-0002-00021-0000-,,0,1,1.00,1,0,"The Manor",395,".766 AC",0,1,1960,"1 Unit, Baseboard - Hotwater","Ceiling Fan, Wall A/C Unit(s)",No,"Blinds, Carbon Monoxide Detector, Fire Extinguisher, Smoke Detector",,"One Floor Unit",15x12,,,,,17x14,,No,9x9,3,0,Flat,Brick,,0.77,*,,,"Carbon Monoxide Detector, Range/Oven-Electric, Refrigerator",0,*,0,*,,*,Monthly,,,,,,,497.02,*,201,,,,Yes,,,,,,23,*,*,,,Yes,"Additional Parking, Blacktop, Off-Street Parking, Parking Lot-Shared",,Unknown,,,"Heat, Maintenance-Common Area, Maintenance-Exterior, See Remarks, Sewer Fees, Snow Removal, Trash Collection, Water Fees",,,,"Carpeting, Tile",,,Gas-Natural,19,"2024-03-01 12:33:32.0",5271958,40.86906714696435,,,,"KELLER WILLIAMS METROPOLITAN",973-539-1120,,-74.38299893765475,,21,*,*,6x9,,,,,,,,"Fee Simple",No,,,POT,,"Great Location!! Excellent Condo/One Floor Unit in the 1st floor. Renovated kitchen and upgraded newer appliances, large pantry and a desirable open floor plan. Wall ACs in the Bedroom and Living Room. 2 large closets in the bedroom, deep closet in the living area. Additional storage and laundry located in the basement, no need to walk out of the building to access laundry.  No apartments/tenants located above. Convenient location close to town, restaurants, shopping, easy access to I-287, RT 10 and Rt 46 and public transportation to NYC. HOA fees include Water, Heat, Gas, snow removal and trash collection. No pets allowed.",,,,,,,,,,,"Eat-In Kitchen, Pantry",,,"1 Bedroom, Bath Main, Kitchen, Living Room",,,,,Breakfast,,,,,,,,,,"Public Sewer",,,,,201,*,"One Floor Unit",,,3665,,*,3.312,*,2023,2023,*,2330,*,*,"Electric, Gas-Natural",,"Public Water","From Furnace",,Approximate,*,,Condo/Coop/Townhouse,Y,,"See Remarks",,,,No,1,"2024-03-01 11:54:25.552",Active,"2024-03-01 11:54:26.0",Y,A,,N,N,973-539-1120
545,"N Main St.",,"Greenwich Twp.",08886-2041,,,,,,271620,,,,,,,000338,,2024-03-01,339000,,,,,Active,,,Warren,"I-78 to exit  4, go right taking you to Main Street, Stewartsville, and house on the right","2024-03-06 18:54:56.0",3888558,,,,,,,,,,,,,,,,,,,,,,,,,3007-00016-0000-00024-0000-,,215400,4,2.00,2,0,,,".31 AC",2,7,1900,"4+ Units, Baseboard - Hotwater, Multi-Zone",None,No,,"Open Porch(es), Patio",Colonial,14x14,14x17,18x17,16x18,14x15,15x17,16x18,Yes,16x14,8,0,"Asphalt Shingle","Vinyl Siding",,0.31,*,,,"Dishwasher, Dryer, Range/Oven-Electric, Refrigerator, Washer",182900,*,32500,*,No,*,,"Full, Unfinished",,Second,Second,Second,,16,*,,,,,No,,,,,,30,*,*,,,No,"1 Car Width, Blacktop, Parking Lot-Exclusive",,No,,,,,,Non-Functional,"Carpeting, Tile, Wood","Detached Garage",,"Electric,OilAbIn",35,"2024-03-01 16:46:16.0",5271820,40.6958511001749,,,,"BHHS FOX & ROACH",908-735-9700,,-75.11313915252687,"Level Lot, Open Lot, Wooded Lot",24,*,*,,,,,,,,,"Fee Simple",Yes,,,POT,,"Throughout the tenure of ownership of the parsonage, the qualified parishioners showed pride of ownership and constantly worked on keeping the bones of this home very healthy.   One feels this when previewing and seeing the awesome basement and depth to the home. Make this 2800 sq ft  treasure , 4 bdrm, 2 bath, your own!  4 Zone heating, and septic replaced in 1992. Please see documents in media section of this listing. Land behind this home (adjacent parcel beyond stream), is farmland preserved, Please verify with township.",,,2019,,,,,,,,"Country Kitchen, Eat-In Kitchen, Separate Dining Area",,First,,,,,,,,,,,,,,,"Cable TV, Garbage Extra Charge",Septic,,,,,545,,Colonial,,,7756,*,*,3.601,*,2023,2023,*,3007,*,*,Electric,No,"Public Water",Oil,,Approximate,*,,"Single Family",Y,,"See Remarks",,,,No,,"2024-03-01 12:11:21.705",Active,"2024-03-01 12:11:22.0",Y,A,,N,N,908-391-6863
218,"Learnington Way",,"Franklin Twp.",08873-6448,,,,,,258621,,,,,,,2404,,2024-03-01,450000,,,,,Active,,,Somerset,"Easton Ave to Willow, Left Denbigh, Right Grantham, Left Learnington Way","2024-03-05 14:11:42.0",3888561,,,,,,,,,,,,,,,,,,,,,,,,,2708-00424-0008-00218-0000-,,391800,3,2.10,2,1,"Regency Homes/Quailbrook",250,28X72,1,,1988,"Forced Hot Air","Central Air",No,,,"Multi Floor Unit",,,,,,,,No,,10,0,"Asphalt Shingle",Brick,,0.05,*,,,"Dishwasher, Dryer, Refrigerator, Washer",201800,*,190000,*,,*,Monthly,,,,,,,424.08,*,,,,,Yes,,,,,,27,*,*,,,,"1 Car Width",,No,,,"Maintenance-Common Area, Maintenance-Exterior, Snow Removal",,,,,InEntrnc,,Gas-Natural,24,"2024-03-01 13:06:15.0",5272278,40.51636,,,,"DREAMLIFE REALTY",732-536-5355,,-74.5104,,218,*,*,,,,,,,,,Condominium,Yes,,,"at closing",,"Please submit the best and final by Wednesday, March 6th at 11 am. This spacious 3-bedroom, 2.5-bathroom townhome is nestled in a sought-after community, conveniently situated near the highway, train station, and various shops. The main floor boasts a living room seamlessly connected to the dining area, alongside an inviting eat-in kitchen featuring a sliding door that leads to the outdoors. Upstairs, you'll find three generously sized bedrooms accompanied by two full bathrooms. Residents of this community enjoy access to amenities such as a playground, pool, and tennis courts. Additionally, the home is located within a highly regarded school district, ensuring an excellent educational experience for residents. The home sells As Is.",,,,,,,,,,,"Eat-In Kitchen",,,,,,,,,,,,,,,,,,"Public Sewer",,,1664,*,218,*,"Multi Floor Unit",,,7565,*,*,1.931,*,2023,2023,*,2708,*,*,Gas-Natural,,"Public Water",,,Approximate,*,,Condo/Coop/Townhouse,Y,,"See Remarks",,,,No,,"2024-03-01 12:32:23.177",Active,"2024-03-01 12:32:23.0",Y,A,,N,N,732-536-5355
2,"Polhemus Dr",,"Hillsborough Twp.",08844-1806,,,,,,405702,,,,,,,304703,,2024-03-01,840000,,,,,Active,,,Somerset,"Route 206 to Homestead Rd, left on Eger Lane, left on Polhemus","2024-03-04 12:33:44.0",3888562,,,,,,,,,,,,,,,,,,,,,,HILLSBORO,HILLSBORO,HILLSBORO,2710-00177-0004-00001-0000-,,693000,4,2.10,2,1,"Pleasant View Farms II",125,0.862,2,,1996,"Forced Hot Air","Central Air",Yes,,"Deck, Patio",Contemporary,,,,,,,,Yes,,8,1,"Asphalt Shingle","Brick, Vinyl Siding",,0.86,*,,,"Carbon Monoxide Detector, Dishwasher, Hot Tub, Microwave Oven, Range/Oven-Gas, Refrigerator",352800,*,340200,*,No,*,Annually,Finished-Partially,"Soaking Tub, Stall Shower And Tub",,,,,177.04,*,,,,,Yes,,,,"Billiards Room",,27,*,*,,,,"Hard Surface",,Unknown,"Washer & Dryer Negotiable",,,,,"Family Room, Wood Burning","Carpeting, Tile, Wood","Attached Garage",,Gas-Natural,39,"2024-03-01 15:09:58.0",5272725,40.48999,,,,"BHHS ZACK SHORE REALTORS",609-597-5800,,-74.65551,Corner,1,*,*,,,,,,,,,"Fee Simple","Call, Cats OK, Dogs OK",,"Above Ground",Negotiable,,"Welcome to this beautiful and well-maintained home located in the desirable Pleasant View Farms ll section of Hillsborough Twp! This home features 9 ft ceilings, hardwood floors, a side entrance garage, and a well-appointed kitchen with granite countertops. The primary bedroom provides an ensuite with a lovely separate tile shower, a soaking tub, and two walk-in closets. The finished basement, newer roof, and newer water heater are great selling points. The family room has a cozy wood-burning fireplace with a beautiful sliding glass door leading to a maintenance-free deck, a custom paver firepit area, an above-ground pool, and a hot tub, all located on nearly an acre lot. The school district and various parks and recreation options, add considerable value to this location. Call for your private showing today.",,,,"GameRoom,Leisure,Storage",,,"Formal Dining Room",,,"Bath(s) Other, Dining Room, Family Room, Foyer, Kitchen, Living Room","Eat-In Kitchen",,,"4 Or More Bedrooms, Bath Main, Bath(s) Other",,,,"Full Bath, Walk-In Closet",,,,,,,,,,,"Public Sewer",,,,*,2,*,Contemporary,,,14920,*,*,2.153,*,2023,2023,*,2710,*,*,"Electric, Gas-Natural",No,"Public Water",Gas,,Approximate,*,,"Single Family",Y,,"See Remarks",,,,No,,"2024-03-01 12:37:29.888",Active,"2024-03-01 12:37:30.0",Y,A,,N,N,609-597-6464
